root@lamp-ubuntu-s-1vcpu-1gb-tor1-01:~# tcpdump -i eth0 port 22
tcpdump: verbose output suppressed, use -v or -vv for full protocol decode
listening on eth0, link-type EN10MB (Ethernet), capture size 262144 bytes
00:21:29.764094 IP 178.128.229.39.ssh > 198.96.87.75.52485: Flags [P.], seq 3574004449:3574004557, ack 1929803694, win 501, options [nop,nop,TS val 1582094798 ecr 563991713], length 108
00:21:29.764217 IP 178.128.229.39.ssh > 198.96.87.75.52485: Flags [P.], seq 108:144, ack 1, win 501, options [nop,nop,TS val 1582094798 ecr 563991713], length 36
00:21:29.764330 IP 178.128.229.39.ssh > 198.96.87.75.52485: Flags [P.], seq 144:252, ack 1, win 501, options [nop,nop,TS val 1582094798 ecr 563991713], length 108
00:21:29.764439 IP 178.128.229.39.ssh > 198.96.87.75.52485: Flags [P.], seq 252:288, ack 1, win 501, options [nop,nop,TS val 1582094798 ecr 563991713], length 36
00:21:29.768891 IP 198.96.87.75.52485 > 178.128.229.39.ssh: Flags [.], ack 108, win 2046, options [nop,nop,TS val 563991725 ecr 1582094798], length 0
00:21:29.768892 IP 198.96.87.75.52485 > 178.128.229.39.ssh: Flags [.], ack 144, win 2045, options [nop,nop,TS val 563991725 ecr 1582094798], length 0
00:21:29.768892 IP 198.96.87.75.52485 > 178.128.229.39.ssh: Flags [.], ack 252, win 2044, options [nop,nop,TS val 563991725 ecr 1582094798], length 0
00:21:29.768892 IP 198.96.87.75.52485 > 178.128.229.39.ssh: Flags [.], ack 288, win 2043, options [nop,nop,TS val 563991725 ecr 1582094798], length 0
00:21:29.887858 IP 178.128.229.39.ssh > 198.96.87.75.52485: Flags [P.], seq 288:1604, ack 1, win 501, options [nop,nop,TS val 1582094922 ecr 563991725], length 1316
00:21:29.888044 IP 178.128.229.39.ssh > 198.96.87.75.52485: Flags [P.], seq 1604:1808, ack 1, win 501, options [nop,nop,TS val 1582094922 ecr 563991725], length 204
00:21:29.888204 IP 178.128.229.39.ssh > 198.96.87.75.52485: Flags [P.], seq 1808:2012, ack 1, win 501, options [nop,nop,TS val 1582094922 ecr 563991725], length 204
00:21:29.888329 IP 178.128.229.39.ssh > 198.96.87.75.52485: Flags [P.], seq 2012:2216, ack 1, win 501, options [nop,nop,TS val 1582094922 ecr 563991725], length 204
00:21:29.888535 IP 178.128.229.39.ssh > 198.96.87.75.52485: Flags [P.], seq 2216:2420, ack 1, win 501, options [nop,nop,TS val 1582094922 ecr 563991725], length 204
00:21:29.888655 IP 178.128.229.39.ssh > 198.96.87.75.52485: Flags [P.], seq 2420:2456, ack 1, win 501, options [nop,nop,TS val 1582094923 ecr 563991725], length 36
00:21:29.888768 IP 178.128.229.39.ssh > 198.96.87.75.52485: Flags [P.], seq 2456:2660, ack 1, win 501, options [nop,nop,TS val 1582094923 ecr 563991725], length 204
00:21:29.888856 IP 178.128.229.39.ssh > 198.96.87.75.52485: Flags [P.], seq 2660:2696, ack 1, win 501, options [nop,nop,TS val 1582094923 ecr 563991725], length 36
00:21:29.888965 IP 178.128.229.39.ssh > 198.96.87.75.52485: Flags [P.], seq 2696:2900, ack 1, win 501, options [nop,nop,TS val 1582094923 ecr 563991725], length 204
00:21:29.890975 IP 198.96.87.75.52485 > 178.128.229.39.ssh: Flags [.], ack 1604, win 2027, options [nop,nop,TS val 563991842 ecr 1582094922], length 0
00:21:29.891017 IP 178.128.229.39.ssh > 198.96.87.75.52485: Flags [P.], seq 2900:3656, ack 1, win 501, options [nop,nop,TS val 1582094925 ecr 563991842], length 756
00:21:29.891159 IP 178.128.229.39.ssh > 198.96.87.75.52485: Flags [P.], seq 3656:3844, ack 1, win 501, options [nop,nop,TS val 1582094925 ecr 563991842], length 188
00:21:29.891281 IP 178.128.229.39.ssh > 198.96.87.75.52485: Flags [P.], seq 3844:3880, ack 1, win 501, options [nop,nop,TS val 1582094925 ecr 563991842], length 36
00:21:29.891403 IP 178.128.229.39.ssh > 198.96.87.75.52485: Flags [P.], seq 3880:4084, ack 1, win 501, options [nop,nop,TS val 1582094925 ecr 563991842], length 204
00:21:29.891645 IP 198.96.87.75.52485 > 178.128.229.39.ssh: Flags [P.], seq 1:37, ack 1604, win 2048, options [nop,nop,TS val 563991842 ecr 1582094922], length 36
00:21:29.893807 IP 198.96.87.75.52485 > 178.128.229.39.ssh: Flags [.], ack 1808, win 2044, options [nop,nop,TS val 563991844 ecr 1582094922], length 0
00:21:29.893807 IP 198.96.87.75.52485 > 178.128.229.39.ssh: Flags [.], ack 2012, win 2041, options [nop,nop,TS val 563991844 ecr 1582094922], length 0
00:21:29.893807 IP 198.96.87.75.52485 > 178.128.229.39.ssh: Flags [.], ack 2216, win 2038, options [nop,nop,TS val 563991844 ecr 1582094922], length 0
00:21:29.893808 IP 198.96.87.75.52485 > 178.128.229.39.ssh: Flags [.], ack 2420, win 2035, options [nop,nop,TS val 563991844 ecr 1582094922], length 0
00:21:29.893808 IP 198.96.87.75.52485 > 178.128.229.39.ssh: Flags [.], ack 2456, win 2034, options [nop,nop,TS val 563991844 ecr 1582094923], length 0
00:21:29.893808 IP 198.96.87.75.52485 > 178.128.229.39.ssh: Flags [.], ack 2660, win 2031, options [nop,nop,TS val 563991844 ecr 1582094923], length 0
00:21:29.893808 IP 198.96.87.75.52485 > 178.128.229.39.ssh: Flags [.], ack 2696, win 2030, options [nop,nop,TS val 563991844 ecr 1582094923], length 0
00:21:29.893808 IP 198.96.87.75.52485 > 178.128.229.39.ssh: Flags [.], ack 2900, win 2027, options [nop,nop,TS val 563991844 ecr 1582094923], length 0
00:21:29.893855 IP 178.128.229.39.ssh > 198.96.87.75.52485: Flags [P.], seq 4084:5072, ack 37, win 501, options [nop,nop,TS val 1582094928 ecr 563991842], length 988
00:21:29.894046 IP 178.128.229.39.ssh > 198.96.87.75.52485: Flags [P.], seq 5072:5260, ack 37, win 501, options [nop,nop,TS val 1582094928 ecr 563991844], length 188
00:21:29.894147 IP 178.128.229.39.ssh > 198.96.87.75.52485: Flags [P.], seq 5260:5296, ack 37, win 501, options [nop,nop,TS val 1582094928 ecr 563991844], length 36
00:21:29.894254 IP 178.128.229.39.ssh > 198.96.87.75.52485: Flags [P.], seq 5296:5484, ack 37, win 501, options [nop,nop,TS val 1582094928 ecr 563991844], length 188
00:21:29.894338 IP 178.128.229.39.ssh > 198.96.87.75.52485: Flags [P.], seq 5484:5520, ack 37, win 501, options [nop,nop,TS val 1582094928 ecr 563991844], length 36
00:21:29.894489 IP 178.128.229.39.ssh > 198.96.87.75.52485: Flags [P.], seq 5520:5708, ack 37, win 501, options [nop,nop,TS val 1582094928 ecr 563991844], length 188
00:21:29.894578 IP 198.96.87.75.52485 > 178.128.229.39.ssh: Flags [.], ack 3656, win 2036, options [nop,nop,TS val 563991844 ecr 1582094925], length 0
00:21:29.894578 IP 198.96.87.75.52485 > 178.128.229.39.ssh: Flags [.], ack 3844, win 2033, options [nop,nop,TS val 563991844 ecr 1582094925], length 0
00:21:29.894622 IP 178.128.229.39.ssh > 198.96.87.75.52485: Flags [P.], seq 5708:5744, ack 37, win 501, options [nop,nop,TS val 1582094929 ecr 563991844], length 36
00:21:29.894729 IP 178.128.229.39.ssh > 198.96.87.75.52485: Flags [P.], seq 5744:5932, ack 37, win 501, options [nop,nop,TS val 1582094929 ecr 563991844], length 188
00:21:29.894819 IP 178.128.229.39.ssh > 198.96.87.75.52485: Flags [P.], seq 5932:5968, ack 37, win 501, options [nop,nop,TS val 1582094929 ecr 563991844], length 36
00:21:29.894928 IP 178.128.229.39.ssh > 198.96.87.75.52485: Flags [P.], seq 5968:6156, ack 37, win 501, options [nop,nop,TS val 1582094929 ecr 563991844], length 188
00:21:29.895013 IP 178.128.229.39.ssh > 198.96.87.75.52485: Flags [P.], seq 6156:6192, ack 37, win 501, options [nop,nop,TS val 1582094929 ecr 563991844], length 36
00:21:29.895119 IP 178.128.229.39.ssh > 198.96.87.75.52485: Flags [P.], seq 6192:6380, ack 37, win 501, options [nop,nop,TS val 1582094929 ecr 563991844], length 188
00:21:29.895203 IP 178.128.229.39.ssh > 198.96.87.75.52485: Flags [P.], seq 6380:6416, ack 37, win 501, options [nop,nop,TS val 1582094929 ecr 563991844], length 36
00:21:29.895326 IP 198.96.87.75.52485 > 178.128.229.39.ssh: Flags [.], ack 3880, win 2047, options [nop,nop,TS val 563991846 ecr 1582094925], length 0
00:21:29.895326 IP 198.96.87.75.52485 > 178.128.229.39.ssh: Flags [.], ack 4084, win 2044, options [nop,nop,TS val 563991846 ecr 1582094925], length 0
00:21:29.895368 IP 178.128.229.39.ssh > 198.96.87.75.52485: Flags [P.], seq 6416:6604, ack 37, win 501, options [nop,nop,TS val 1582094929 ecr 563991846], length 188
00:21:29.895455 IP 178.128.229.39.ssh > 198.96.87.75.52485: Flags [P.], seq 6604:6640, ack 37, win 501, options [nop,nop,TS val 1582094929 ecr 563991846], length 36
00:21:29.895614 IP 178.128.229.39.ssh > 198.96.87.75.52485: Flags [P.], seq 6640:6828, ack 37, win 501, options [nop,nop,TS val 1582094930 ecr 563991846], length 188
00:21:29.895704 IP 178.128.229.39.ssh > 198.96.87.75.52485: Flags [P.], seq 6828:6864, ack 37, win 501, options [nop,nop,TS val 1582094930 ecr 563991846], length 36
00:21:29.895816 IP 178.128.229.39.ssh > 198.96.87.75.52485: Flags [P.], seq 6864:7068, ack 37, win 501, options [nop,nop,TS val 1582094930 ecr 563991846], length 204
00:21:29.895901 IP 178.128.229.39.ssh > 198.96.87.75.52485: Flags [P.], seq 7068:7104, ack 37, win 501, options [nop,nop,TS val 1582094930 ecr 563991846], length 36
00:21:29.896009 IP 178.128.229.39.ssh > 198.96.87.75.52485: Flags [P.], seq 7104:7308, ack 37, win 501, options [nop,nop,TS val 1582094930 ecr 563991846], length 204
00:21:29.896092 IP 178.128.229.39.ssh > 198.96.87.75.52485: Flags [P.], seq 7308:7344, ack 37, win 501, options [nop,nop,TS val 1582094930 ecr 563991846], length 36
00:21:29.896199 IP 178.128.229.39.ssh > 198.96.87.75.52485: Flags [P.], seq 7344:7548, ack 37, win 501, options [nop,nop,TS val 1582094930 ecr 563991846], length 204
00:21:29.896285 IP 178.128.229.39.ssh > 198.96.87.75.52485: Flags [P.], seq 7548:7584, ack 37, win 501, options [nop,nop,TS val 1582094930 ecr 563991846], length 36
00:21:29.896429 IP 178.128.229.39.ssh > 198.96.87.75.52485: Flags [P.], seq 7584:7788, ack 37, win 501, options [nop,nop,TS val 1582094930 ecr 563991846], length 204
00:21:29.899574 IP 198.96.87.75.52485 > 178.128.229.39.ssh: Flags [.], ack 5072, win 2032, options [nop,nop,TS val 563991849 ecr 1582094928], length 0
00:21:29.899574 IP 198.96.87.75.52485 > 178.128.229.39.ssh: Flags [.], ack 5260, win 2029, options [nop,nop,TS val 563991849 ecr 1582094928], length 0
00:21:29.899575 IP 198.96.87.75.52485 > 178.128.229.39.ssh: Flags [.], ack 5296, win 2029, options [nop,nop,TS val 563991849 ecr 1582094928], length 0
00:21:29.899575 IP 198.96.87.75.52485 > 178.128.229.39.ssh: Flags [.], ack 5484, win 2026, options [nop,nop,TS val 563991849 ecr 1582094928], length 0
00:21:29.899575 IP 198.96.87.75.52485 > 178.128.229.39.ssh: Flags [.], ack 5520, win 2025, options [nop,nop,TS val 563991849 ecr 1582094928], length 0
00:21:29.899575 IP 198.96.87.75.52485 > 178.128.229.39.ssh: Flags [.], ack 5708, win 2022, options [nop,nop,TS val 563991849 ecr 1582094928], length 0
00:21:29.899575 IP 198.96.87.75.52485 > 178.128.229.39.ssh: Flags [.], ack 5744, win 2022, options [nop,nop,TS val 563991849 ecr 1582094929], length 0
00:21:29.899575 IP 198.96.87.75.52485 > 178.128.229.39.ssh: Flags [.], ack 5932, win 2019, options [nop,nop,TS val 563991849 ecr 1582094929], length 0
00:21:29.899627 IP 178.128.229.39.ssh > 198.96.87.75.52485: Flags [P.], seq 7788:10364, ack 37, win 501, options [nop,nop,TS val 1582094934 ecr 563991849], length 2576
00:21:29.899668 IP 178.128.229.39.ssh > 198.96.87.75.52485: Flags [P.], seq 10364:13520, ack 37, win 501, options [nop,nop,TS val 1582094934 ecr 563991849], length 3156
00:21:29.899716 IP 198.96.87.75.52485 > 178.128.229.39.ssh: Flags [.], ack 5968, win 2018, options [nop,nop,TS val 563991849 ecr 1582094929], length 0
00:21:29.899716 IP 198.96.87.75.52485 > 178.128.229.39.ssh: Flags [.], ack 6156, win 2015, options [nop,nop,TS val 563991849 ecr 1582094929], length 0
00:21:29.899716 IP 198.96.87.75.52485 > 178.128.229.39.ssh: Flags [.], ack 6192, win 2015, options [nop,nop,TS val 563991849 ecr 1582094929], length 0
00:21:29.899716 IP 198.96.87.75.52485 > 178.128.229.39.ssh: Flags [.], ack 6380, win 2012, options [nop,nop,TS val 563991849 ecr 1582094929], length 0
00:21:29.899716 IP 198.96.87.75.52485 > 178.128.229.39.ssh: Flags [.], ack 6416, win 2011, options [nop,nop,TS val 563991849 ecr 1582094929], length 0
00:21:29.899716 IP 198.96.87.75.52485 > 178.128.229.39.ssh: Flags [.], ack 6604, win 2008, options [nop,nop,TS val 563991849 ecr 1582094929], length 0
00:21:29.899716 IP 198.96.87.75.52485 > 178.128.229.39.ssh: Flags [.], ack 6640, win 2008, options [nop,nop,TS val 563991849 ecr 1582094929], length 0
00:21:29.899861 IP 178.128.229.39.ssh > 198.96.87.75.52485: Flags [P.], seq 13520:13708, ack 37, win 501, options [nop,nop,TS val 1582094934 ecr 563991849], length 188
00:21:29.900059 IP 178.128.229.39.ssh > 198.96.87.75.52485: Flags [P.], seq 13708:14504, ack 37, win 501, options [nop,nop,TS val 1582094934 ecr 563991849], length 796
00:21:29.900237 IP 178.128.229.39.ssh > 198.96.87.75.52485: Flags [P.], seq 14504:15188, ack 37, win 501, options [nop,nop,TS val 1582094934 ecr 563991849], length 684
00:21:29.900448 IP 178.128.229.39.ssh > 198.96.87.75.52485: Flags [P.], seq 15188:15680, ack 37, win 501, options [nop,nop,TS val 1582094934 ecr 563991849], length 492
00:21:29.900728 IP 178.128.229.39.ssh > 198.96.87.75.52485: Flags [P.], seq 15680:16660, ack 37, win 501, options [nop,nop,TS val 1582094935 ecr 563991849], length 980
00:21:29.900912 IP 178.128.229.39.ssh > 198.96.87.75.52485: Flags [P.], seq 16660:17208, ack 37, win 501, options [nop,nop,TS val 1582094935 ecr 563991849], length 548
00:21:29.901039 IP 178.128.229.39.ssh > 198.96.87.75.52485: Flags [P.], seq 17208:17412, ack 37, win 501, options [nop,nop,TS val 1582094935 ecr 563991849], length 204
00:21:29.901161 IP 178.128.229.39.ssh > 198.96.87.75.52485: Flags [P.], seq 17412:17616, ack 37, win 501, options [nop,nop,TS val 1582094935 ecr 563991849], length 204
00:21:29.901279 IP 178.128.229.39.ssh > 198.96.87.75.52485: Flags [P.], seq 17616:17820, ack 37, win 501, options [nop,nop,TS val 1582094935 ecr 563991849], length 204
00:21:29.901376 IP 198.96.87.75.52485 > 178.128.229.39.ssh: Flags [.], ack 6828, win 2045, options [nop,nop,TS val 563991851 ecr 1582094930], length 0
00:21:29.901376 IP 198.96.87.75.52485 > 178.128.229.39.ssh: Flags [.], ack 6864, win 2044, options [nop,nop,TS val 563991851 ecr 1582094930], length 0
00:21:29.901376 IP 198.96.87.75.52485 > 178.128.229.39.ssh: Flags [.], ack 7068, win 2041, options [nop,nop,TS val 563991851 ecr 1582094930], length 0
00:21:29.901376 IP 198.96.87.75.52485 > 178.128.229.39.ssh: Flags [.], ack 7104, win 2040, options [nop,nop,TS val 563991851 ecr 1582094930], length 0
00:21:29.901416 IP 198.96.87.75.52485 > 178.128.229.39.ssh: Flags [.], ack 7308, win 2037, options [nop,nop,TS val 563991851 ecr 1582094930], length 0
00:21:29.901416 IP 198.96.87.75.52485 > 178.128.229.39.ssh: Flags [.], ack 7344, win 2037, options [nop,nop,TS val 563991851 ecr 1582094930], length 0
00:21:29.901416 IP 198.96.87.75.52485 > 178.128.229.39.ssh: Flags [.], ack 7548, win 2033, options [nop,nop,TS val 563991851 ecr 1582094930], length 0
00:21:29.901416 IP 198.96.87.75.52485 > 178.128.229.39.ssh: Flags [.], ack 7584, win 2033, options [nop,nop,TS val 563991851 ecr 1582094930], length 0
00:21:29.901443 IP 198.96.87.75.52485 > 178.128.229.39.ssh: Flags [.], ack 7788, win 2030, options [nop,nop,TS val 563991851 ecr 1582094930], length 0
00:21:29.901663 IP 178.128.229.39.ssh > 198.96.87.75.52485: Flags [P.], seq 17820:19392, ack 37, win 501, options [nop,nop,TS val 1582094936 ecr 563991851], length 1572
00:21:29.901794 IP 178.128.229.39.ssh > 198.96.87.75.52485: Flags [P.], seq 19392:19596, ack 37, win 501, options [nop,nop,TS val 1582094936 ecr 563991851], length 204
00:21:29.901915 IP 178.128.229.39.ssh > 198.96.87.75.52485: Flags [P.], seq 19596:19800, ack 37, win 501, options [nop,nop,TS val 1582094936 ecr 563991851], length 204
00:21:29.902043 IP 178.128.229.39.ssh > 198.96.87.75.52485: Flags [P.], seq 19800:20004, ack 37, win 501, options [nop,nop,TS val 1582094936 ecr 563991851], length 204
00:21:29.902169 IP 178.128.229.39.ssh > 198.96.87.75.52485: Flags [P.], seq 20004:20208, ack 37, win 501, options [nop,nop,TS val 1582094936 ecr 563991851], length 204
00:21:29.902300 IP 178.128.229.39.ssh > 198.96.87.75.52485: Flags [P.], seq 20208:20412, ack 37, win 501, options [nop,nop,TS val 1582094936 ecr 563991851], length 204
00:21:29.902418 IP 178.128.229.39.ssh > 198.96.87.75.52485: Flags [P.], seq 20412:20616, ack 37, win 501, options [nop,nop,TS val 1582094936 ecr 563991851], length 204
00:21:29.902535 IP 178.128.229.39.ssh > 198.96.87.75.52485: Flags [P.], seq 20616:20820, ack 37, win 501, options [nop,nop,TS val 1582094936 ecr 563991851], length 204
00:21:29.902652 IP 178.128.229.39.ssh > 198.96.87.75.52485: Flags [P.], seq 20820:21024, ack 37, win 501, options [nop,nop,TS val 1582094937 ecr 563991851], length 204
00:21:29.902769 IP 178.128.229.39.ssh > 198.96.87.75.52485: Flags [P.], seq 21024:21228, ack 37, win 501, options [nop,nop,TS val 1582094937 ecr 563991851], length 204
00:21:29.902961 IP 178.128.229.39.ssh > 198.96.87.75.52485: Flags [P.], seq 21228:21432, ack 37, win 501, options [nop,nop,TS val 1582094937 ecr 563991851], length 204
00:21:29.903131 IP 178.128.229.39.ssh > 198.96.87.75.52485: Flags [P.], seq 21432:21636, ack 37, win 501, options [nop,nop,TS val 1582094937 ecr 563991851], length 204
00:21:29.903270 IP 178.128.229.39.ssh > 198.96.87.75.52485: Flags [P.], seq 21636:21840, ack 37, win 501, options [nop,nop,TS val 1582094937 ecr 563991851], length 204
00:21:29.903398 IP 178.128.229.39.ssh > 198.96.87.75.52485: Flags [P.], seq 21840:22044, ack 37, win 501, options [nop,nop,TS val 1582094937 ecr 563991851], length 204
00:21:29.903553 IP 178.128.229.39.ssh > 198.96.87.75.52485: Flags [P.], seq 22044:22248, ack 37, win 501, options [nop,nop,TS val 1582094937 ecr 563991851], length 204
00:21:29.903676 IP 178.128.229.39.ssh > 198.96.87.75.52485: Flags [P.], seq 22248:22452, ack 37, win 501, options [nop,nop,TS val 1582094938 ecr 563991851], length 204
00:21:29.903798 IP 178.128.229.39.ssh > 198.96.87.75.52485: Flags [P.], seq 22452:22656, ack 37, win 501, options [nop,nop,TS val 1582094938 ecr 563991851], length 204
00:21:29.903917 IP 178.128.229.39.ssh > 198.96.87.75.52485: Flags [P.], seq 22656:22860, ack 37, win 501, options [nop,nop,TS val 1582094938 ecr 563991851], length 204
00:21:29.904080 IP 178.128.229.39.ssh > 198.96.87.75.52485: Flags [P.], seq 22860:23064, ack 37, win 501, options [nop,nop,TS val 1582094938 ecr 563991851], length 204
00:21:29.904216 IP 178.128.229.39.ssh > 198.96.87.75.52485: Flags [P.], seq 23064:23268, ack 37, win 501, options [nop,nop,TS val 1582094938 ecr 563991851], length 204
00:21:29.904377 IP 178.128.229.39.ssh > 198.96.87.75.52485: Flags [P.], seq 23268:23472, ack 37, win 501, options [nop,nop,TS val 1582094938 ecr 563991851], length 204
00:21:29.904502 IP 178.128.229.39.ssh > 198.96.87.75.52485: Flags [P.], seq 23472:23676, ack 37, win 501, options [nop,nop,TS val 1582094938 ecr 563991851], length 204
00:21:29.904629 IP 178.128.229.39.ssh > 198.96.87.75.52485: Flags [P.], seq 23676:23880, ack 37, win 501, options [nop,nop,TS val 1582094939 ecr 563991851], length 204
00:21:29.904754 IP 178.128.229.39.ssh > 198.96.87.75.52485: Flags [P.], seq 23880:24084, ack 37, win 501, options [nop,nop,TS val 1582094939 ecr 563991851], length 204
00:21:29.904875 IP 178.128.229.39.ssh > 198.96.87.75.52485: Flags [P.], seq 24084:24288, ack 37, win 501, options [nop,nop,TS val 1582094939 ecr 563991851], length 204
00:21:29.905001 IP 178.128.229.39.ssh > 198.96.87.75.52485: Flags [P.], seq 24288:24492, ack 37, win 501, options [nop,nop,TS val 1582094939 ecr 563991851], length 204
00:21:29.905118 IP 178.128.229.39.ssh > 198.96.87.75.52485: Flags [P.], seq 24492:24696, ack 37, win 501, options [nop,nop,TS val 1582094939 ecr 563991851], length 204
00:21:29.905248 IP 178.128.229.39.ssh > 198.96.87.75.52485: Flags [P.], seq 24696:24900, ack 37, win 501, options [nop,nop,TS val 1582094939 ecr 563991851], length 204
00:21:29.905389 IP 178.128.229.39.ssh > 198.96.87.75.52485: Flags [P.], seq 24900:25104, ack 37, win 501, options [nop,nop,TS val 1582094939 ecr 563991851], length 204
00:21:29.905505 IP 178.128.229.39.ssh > 198.96.87.75.52485: Flags [P.], seq 25104:25308, ack 37, win 501, options [nop,nop,TS val 1582094939 ecr 563991851], length 204
00:21:29.905624 IP 178.128.229.39.ssh > 198.96.87.75.52485: Flags [P.], seq 25308:25512, ack 37, win 501, options [nop,nop,TS val 1582094940 ecr 563991851], length 204
00:21:29.905750 IP 178.128.229.39.ssh > 198.96.87.75.52485: Flags [P.], seq 25512:25716, ack 37, win 501, options [nop,nop,TS val 1582094940 ecr 563991851], length 204
00:21:29.905868 IP 178.128.229.39.ssh > 198.96.87.75.52485: Flags [P.], seq 25716:25920, ack 37, win 501, options [nop,nop,TS val 1582094940 ecr 563991851], length 204
00:21:29.905989 IP 198.96.87.75.52485 > 178.128.229.39.ssh: Flags [.], ack 10364, win 2007, options [nop,nop,TS val 563991854 ecr 1582094934], length 0
00:21:29.905989 IP 198.96.87.75.52485 > 178.128.229.39.ssh: Flags [.], ack 13520, win 1978, options [nop,nop,TS val 563991854 ecr 1582094934], length 0
00:21:29.905989 IP 198.96.87.75.52485 > 178.128.229.39.ssh: Flags [.], ack 13520, win 2048, options [nop,nop,TS val 563991854 ecr 1582094934], length 0
00:21:29.905989 IP 198.96.87.75.52485 > 178.128.229.39.ssh: Flags [.], ack 13708, win 2045, options [nop,nop,TS val 563991854 ecr 1582094934], length 0
00:21:29.905989 IP 198.96.87.75.52485 > 178.128.229.39.ssh: Flags [.], ack 14504, win 2032, options [nop,nop,TS val 563991854 ecr 1582094934], length 0
00:21:29.905989 IP 198.96.87.75.52485 > 178.128.229.39.ssh: Flags [.], ack 15188, win 2021, options [nop,nop,TS val 563991854 ecr 1582094934], length 0
00:21:29.905989 IP 198.96.87.75.52485 > 178.128.229.39.ssh: Flags [.], ack 15680, win 2014, options [nop,nop,TS val 563991854 ecr 1582094934], length 0
00:21:29.906044 IP 198.96.87.75.52485 > 178.128.229.39.ssh: Flags [.], ack 16660, win 1998, options [nop,nop,TS val 563991854 ecr 1582094935], length 0
00:21:29.906044 IP 198.96.87.75.52485 > 178.128.229.39.ssh: Flags [.], ack 17208, win 1990, options [nop,nop,TS val 563991854 ecr 1582094935], length 0
00:21:29.906045 IP 198.96.87.75.52485 > 178.128.229.39.ssh: Flags [.], ack 17412, win 1987, options [nop,nop,TS val 563991854 ecr 1582094935], length 0
00:21:29.906045 IP 198.96.87.75.52485 > 178.128.229.39.ssh: Flags [.], ack 17616, win 1984, options [nop,nop,TS val 563991854 ecr 1582094935], length 0
00:21:29.906045 IP 198.96.87.75.52485 > 178.128.229.39.ssh: Flags [.], ack 17616, win 2048, options [nop,nop,TS val 563991854 ecr 1582094935], length 0
00:21:29.906342 IP 178.128.229.39.ssh > 198.96.87.75.52485: Flags [P.], seq 25920:27964, ack 37, win 501, options [nop,nop,TS val 1582094940 ecr 563991854], length 2044
00:21:29.906582 IP 178.128.229.39.ssh > 198.96.87.75.52485: Flags [P.], seq 27964:28168, ack 37, win 501, options [nop,nop,TS val 1582094940 ecr 563991854], length 204
00:21:29.906759 IP 178.128.229.39.ssh > 198.96.87.75.52485: Flags [P.], seq 28168:28372, ack 37, win 501, options [nop,nop,TS val 1582094941 ecr 563991854], length 204
00:21:29.906895 IP 178.128.229.39.ssh > 198.96.87.75.52485: Flags [P.], seq 28372:28576, ack 37, win 501, options [nop,nop,TS val 1582094941 ecr 563991854], length 204
00:21:29.907021 IP 178.128.229.39.ssh > 198.96.87.75.52485: Flags [P.], seq 28576:28780, ack 37, win 501, options [nop,nop,TS val 1582094941 ecr 563991854], length 204
00:21:29.907153 IP 178.128.229.39.ssh > 198.96.87.75.52485: Flags [P.], seq 28780:28984, ack 37, win 501, options [nop,nop,TS val 1582094941 ecr 563991854], length 204
00:21:29.907272 IP 178.128.229.39.ssh > 198.96.87.75.52485: Flags [P.], seq 28984:29188, ack 37, win 501, options [nop,nop,TS val 1582094941 ecr 563991854], length 204
00:21:29.907406 IP 178.128.229.39.ssh > 198.96.87.75.52485: Flags [P.], seq 29188:29392, ack 37, win 501, options [nop,nop,TS val 1582094941 ecr 563991854], length 204
00:21:29.907552 IP 178.128.229.39.ssh > 198.96.87.75.52485: Flags [P.], seq 29392:29596, ack 37, win 501, options [nop,nop,TS val 1582094941 ecr 563991854], length 204
00:21:29.907642 IP 198.96.87.75.52485 > 178.128.229.39.ssh: Flags [.], ack 17820, win 2044, options [nop,nop,TS val 563991855 ecr 1582094935], length 0
00:21:29.907642 IP 198.96.87.75.52485 > 178.128.229.39.ssh: Flags [.], ack 19392, win 2020, options [nop,nop,TS val 563991855 ecr 1582094936], length 0
00:21:29.907642 IP 198.96.87.75.52485 > 178.128.229.39.ssh: Flags [.], ack 19596, win 2017, options [nop,nop,TS val 563991855 ecr 1582094936], length 0
00:21:29.907642 IP 198.96.87.75.52485 > 178.128.229.39.ssh: Flags [.], ack 19800, win 2013, options [nop,nop,TS val 563991855 ecr 1582094936], length 0
00:21:29.907642 IP 198.96.87.75.52485 > 178.128.229.39.ssh: Flags [.], ack 20004, win 2010, options [nop,nop,TS val 563991855 ecr 1582094936], length 0
00:21:29.907642 IP 198.96.87.75.52485 > 178.128.229.39.ssh: Flags [.], ack 20208, win 2007, options [nop,nop,TS val 563991855 ecr 1582094936], length 0
00:21:29.907688 IP 198.96.87.75.52485 > 178.128.229.39.ssh: Flags [.], ack 20412, win 2004, options [nop,nop,TS val 563991855 ecr 1582094936], length 0
00:21:29.907688 IP 198.96.87.75.52485 > 178.128.229.39.ssh: Flags [.], ack 20616, win 2001, options [nop,nop,TS val 563991855 ecr 1582094936], length 0
00:21:29.907689 IP 198.96.87.75.52485 > 178.128.229.39.ssh: Flags [.], ack 20820, win 1997, options [nop,nop,TS val 563991855 ecr 1582094936], length 0
00:21:29.907689 IP 198.96.87.75.52485 > 178.128.229.39.ssh: Flags [.], ack 21024, win 1994, options [nop,nop,TS val 563991855 ecr 1582094937], length 0
00:21:29.907689 IP 198.96.87.75.52485 > 178.128.229.39.ssh: Flags [.], ack 21228, win 1991, options [nop,nop,TS val 563991855 ecr 1582094937], length 0
00:21:29.907720 IP 198.96.87.75.52485 > 178.128.229.39.ssh: Flags [.], ack 21432, win 1988, options [nop,nop,TS val 563991855 ecr 1582094937], length 0
00:21:29.907720 IP 198.96.87.75.52485 > 178.128.229.39.ssh: Flags [.], ack 21636, win 1988, options [nop,nop,TS val 563991855 ecr 1582094937], length 0
00:21:29.907720 IP 198.96.87.75.52485 > 178.128.229.39.ssh: Flags [.], ack 21636, win 2048, options [nop,nop,TS val 563991855 ecr 1582094937], length 0
00:21:29.907742 IP 198.96.87.75.52485 > 178.128.229.39.ssh: Flags [.], ack 21840, win 2044, options [nop,nop,TS val 563991855 ecr 1582094937], length 0
00:21:29.908090 IP 178.128.229.39.ssh > 198.96.87.75.52485: Flags [P.], seq 29596:32096, ack 37, win 501, options [nop,nop,TS val 1582094942 ecr 563991855], length 2500
00:21:29.908255 IP 178.128.229.39.ssh > 198.96.87.75.52485: Flags [P.], seq 32096:32300, ack 37, win 501, options [nop,nop,TS val 1582094942 ecr 563991855], length 204
00:21:29.908449 IP 178.128.229.39.ssh > 198.96.87.75.52485: Flags [P.], seq 32300:32504, ack 37, win 501, options [nop,nop,TS val 1582094942 ecr 563991855], length 204
00:21:29.908641 IP 178.128.229.39.ssh > 198.96.87.75.52485: Flags [P.], seq 32504:32708, ack 37, win 501, options [nop,nop,TS val 1582094943 ecr 563991855], length 204
00:21:29.908779 IP 178.128.229.39.ssh > 198.96.87.75.52485: Flags [P.], seq 32708:32912, ack 37, win 501, options [nop,nop,TS val 1582094943 ecr 563991855], length 204
00:21:29.908913 IP 178.128.229.39.ssh > 198.96.87.75.52485: Flags [P.], seq 32912:33116, ack 37, win 501, options [nop,nop,TS val 1582094943 ecr 563991855], length 204
00:21:29.909041 IP 178.128.229.39.ssh > 198.96.87.75.52485: Flags [P.], seq 33116:33320, ack 37, win 501, options [nop,nop,TS val 1582094943 ecr 563991855], length 204
00:21:29.909168 IP 178.128.229.39.ssh > 198.96.87.75.52485: Flags [P.], seq 33320:33524, ack 37, win 501, options [nop,nop,TS val 1582094943 ecr 563991855], length 204
00:21:29.909286 IP 178.128.229.39.ssh > 198.96.87.75.52485: Flags [P.], seq 33524:33728, ack 37, win 501, options [nop,nop,TS val 1582094943 ecr 563991855], length 204
00:21:29.909408 IP 178.128.229.39.ssh > 198.96.87.75.52485: Flags [P.], seq 33728:33932, ack 37, win 501, options [nop,nop,TS val 1582094943 ecr 563991855], length 204
00:21:29.909534 IP 178.128.229.39.ssh > 198.96.87.75.52485: Flags [P.], seq 33932:34136, ack 37, win 501, options [nop,nop,TS val 1582094943 ecr 563991855], length 204
00:21:29.909701 IP 178.128.229.39.ssh > 198.96.87.75.52485: Flags [P.], seq 34136:34340, ack 37, win 501, options [nop,nop,TS val 1582094944 ecr 563991855], length 204
00:21:29.909859 IP 178.128.229.39.ssh > 198.96.87.75.52485: Flags [P.], seq 34340:34544, ack 37, win 501, options [nop,nop,TS val 1582094944 ecr 563991855], length 204
00:21:29.909988 IP 178.128.229.39.ssh > 198.96.87.75.52485: Flags [P.], seq 34544:34748, ack 37, win 501, options [nop,nop,TS val 1582094944 ecr 563991855], length 204
00:21:29.910109 IP 178.128.229.39.ssh > 198.96.87.75.52485: Flags [P.], seq 34748:34952, ack 37, win 501, options [nop,nop,TS val 1582094944 ecr 563991855], length 204
00:21:29.910255 IP 178.128.229.39.ssh > 198.96.87.75.52485: Flags [P.], seq 34952:35156, ack 37, win 501, options [nop,nop,TS val 1582094944 ecr 563991855], length 204
00:21:29.910379 IP 178.128.229.39.ssh > 198.96.87.75.52485: Flags [P.], seq 35156:35360, ack 37, win 501, options [nop,nop,TS val 1582094944 ecr 563991855], length 204
00:21:29.910507 IP 178.128.229.39.ssh > 198.96.87.75.52485: Flags [P.], seq 35360:35564, ack 37, win 501, options [nop,nop,TS val 1582094944 ecr 563991855], length 204
00:21:29.911209 IP 198.96.87.75.52485 > 178.128.229.39.ssh: Flags [.], ack 22044, win 2044, options [nop,nop,TS val 563991857 ecr 1582094937], length 0
00:21:29.911209 IP 198.96.87.75.52485 > 178.128.229.39.ssh: Flags [.], ack 22248, win 2041, options [nop,nop,TS val 563991857 ecr 1582094937], length 0
00:21:29.911209 IP 198.96.87.75.52485 > 178.128.229.39.ssh: Flags [.], ack 22452, win 2038, options [nop,nop,TS val 563991857 ecr 1582094938], length 0
00:21:29.911209 IP 198.96.87.75.52485 > 178.128.229.39.ssh: Flags [.], ack 22656, win 2035, options [nop,nop,TS val 563991857 ecr 1582094938], length 0
00:21:29.911209 IP 198.96.87.75.52485 > 178.128.229.39.ssh: Flags [.], ack 22860, win 2032, options [nop,nop,TS val 563991857 ecr 1582094938], length 0
00:21:29.911209 IP 198.96.87.75.52485 > 178.128.229.39.ssh: Flags [.], ack 23064, win 2028, options [nop,nop,TS val 563991857 ecr 1582094938], length 0
00:21:29.911209 IP 198.96.87.75.52485 > 178.128.229.39.ssh: Flags [.], ack 23268, win 2025, options [nop,nop,TS val 563991857 ecr 1582094938], length 0
00:21:29.911209 IP 198.96.87.75.52485 > 178.128.229.39.ssh: Flags [.], ack 23472, win 2022, options [nop,nop,TS val 563991857 ecr 1582094938], length 0
00:21:29.911250 IP 178.128.229.39.ssh > 198.96.87.75.52485: Flags [P.], seq 35564:35768, ack 37, win 501, options [nop,nop,TS val 1582094945 ecr 563991857], length 204
00:21:29.911293 IP 198.96.87.75.52485 > 178.128.229.39.ssh: Flags [.], ack 23676, win 2019, options [nop,nop,TS val 563991857 ecr 1582094938], length 0
00:21:29.911294 IP 198.96.87.75.52485 > 178.128.229.39.ssh: Flags [.], ack 23880, win 2016, options [nop,nop,TS val 563991857 ecr 1582094939], length 0
00:21:29.911294 IP 198.96.87.75.52485 > 178.128.229.39.ssh: Flags [.], ack 24084, win 2012, options [nop,nop,TS val 563991857 ecr 1582094939], length 0
00:21:29.911294 IP 198.96.87.75.52485 > 178.128.229.39.ssh: Flags [.], ack 24288, win 2009, options [nop,nop,TS val 563991857 ecr 1582094939], length 0
00:21:29.911294 IP 198.96.87.75.52485 > 178.128.229.39.ssh: Flags [.], ack 24492, win 2006, options [nop,nop,TS val 563991857 ecr 1582094939], length 0
00:21:29.911294 IP 198.96.87.75.52485 > 178.128.229.39.ssh: Flags [.], ack 24696, win 2003, options [nop,nop,TS val 563991857 ecr 1582094939], length 0
00:21:29.911294 IP 198.96.87.75.52485 > 178.128.229.39.ssh: Flags [.], ack 24900, win 2000, options [nop,nop,TS val 563991857 ecr 1582094939], length 0
00:21:29.911294 IP 198.96.87.75.52485 > 178.128.229.39.ssh: Flags [.], ack 25104, win 1997, options [nop,nop,TS val 563991857 ecr 1582094939], length 0
00:21:29.911330 IP 198.96.87.75.52485 > 178.128.229.39.ssh: Flags [.], ack 25104, win 2048, options [nop,nop,TS val 563991857 ecr 1582094939], length 0
00:21:29.911421 IP 198.96.87.75.52485 > 178.128.229.39.ssh: Flags [.], ack 25308, win 2044, options [nop,nop,TS val 563991858 ecr 1582094939], length 0
00:21:29.911421 IP 198.96.87.75.52485 > 178.128.229.39.ssh: Flags [.], ack 25512, win 2041, options [nop,nop,TS val 563991858 ecr 1582094940], length 0
00:21:29.911421 IP 198.96.87.75.52485 > 178.128.229.39.ssh: Flags [.], ack 25716, win 2038, options [nop,nop,TS val 563991858 ecr 1582094940], length 0
00:21:29.911421 IP 198.96.87.75.52485 > 178.128.229.39.ssh: Flags [.], ack 25920, win 2035, options [nop,nop,TS val 563991858 ecr 1582094940], length 0
00:21:29.911846 IP 178.128.229.39.ssh > 198.96.87.75.52485: Flags [P.], seq 35768:39188, ack 37, win 501, options [nop,nop,TS val 1582094946 ecr 563991858], length 3420
00:21:29.912172 IP 178.128.229.39.ssh > 198.96.87.75.52485: Flags [P.], seq 39188:39392, ack 37, win 501, options [nop,nop,TS val 1582094946 ecr 563991858], length 204
00:21:29.912854 IP 198.96.87.75.52485 > 178.128.229.39.ssh: Flags [.], ack 27964, win 2016, options [nop,nop,TS val 563991859 ecr 1582094940], length 0
00:21:29.912854 IP 198.96.87.75.52485 > 178.128.229.39.ssh: Flags [.], ack 28168, win 2012, options [nop,nop,TS val 563991859 ecr 1582094940], length 0
00:21:29.912854 IP 198.96.87.75.52485 > 178.128.229.39.ssh: Flags [.], ack 28372