root@lamp-ubuntu-s-1vcpu-1gb-tor1-01:~# tcpdump -i eth0 tcp
tcpdump: verbose output suppressed, use -v or -vv for full protocol decode
listening on eth0, link-type EN10MB (Ethernet), capture size 262144 bytes
00:20:53.848319 IP 178.128.229.39.ssh > 198.96.87.75.52485: Flags [P.], seq 3572352689:3572352797, ack 1929801870, win 501, options [nop,nop,TS val 1582058882 ecr 563956068], length 108
00:20:53.848565 IP 178.128.229.39.ssh > 198.96.87.75.52485: Flags [P.], seq 108:144, ack 1, win 501, options [nop,nop,TS val 1582058882 ecr 563956068], length 36
00:20:53.848773 IP 178.128.229.39.ssh > 198.96.87.75.52485: Flags [P.], seq 144:252, ack 1, win 501, options [nop,nop,TS val 1582058883 ecr 563956068], length 108
00:20:53.848960 IP 178.128.229.39.ssh > 198.96.87.75.52485: Flags [P.], seq 252:288, ack 1, win 501, options [nop,nop,TS val 1582058883 ecr 563956068], length 36
00:20:53.851393 IP 198.96.87.75.52485 > 178.128.229.39.ssh: Flags [.], ack 108, win 2046, options [nop,nop,TS val 563956083 ecr 1582058882], length 0
00:20:53.851394 IP 198.96.87.75.52485 > 178.128.229.39.ssh: Flags [.], ack 144, win 2045, options [nop,nop,TS val 563956083 ecr 1582058882], length 0
00:20:53.852683 IP 198.96.87.75.52485 > 178.128.229.39.ssh: Flags [.], ack 252, win 2046, options [nop,nop,TS val 563956083 ecr 1582058883], length 0
00:20:53.852683 IP 198.96.87.75.52485 > 178.128.229.39.ssh: Flags [.], ack 288, win 2045, options [nop,nop,TS val 563956083 ecr 1582058883], length 0
00:20:53.854231 IP 178.128.229.39.ssh > 198.96.87.75.52485: Flags [P.], seq 288:508, ack 1, win 501, options [nop,nop,TS val 1582058888 ecr 563956083], length 220
00:20:53.854381 IP 178.128.229.39.ssh > 198.96.87.75.52485: Flags [P.], seq 508:544, ack 1, win 501, options [nop,nop,TS val 1582058888 ecr 563956083], length 36
00:20:53.854501 IP 178.128.229.39.ssh > 198.96.87.75.52485: Flags [P.], seq 544:740, ack 1, win 501, options [nop,nop,TS val 1582058888 ecr 563956083], length 196
00:20:53.854594 IP 178.128.229.39.ssh > 198.96.87.75.52485: Flags [P.], seq 740:776, ack 1, win 501, options [nop,nop,TS val 1582058889 ecr 563956083], length 36
00:20:53.854715 IP 178.128.229.39.ssh > 198.96.87.75.52485: Flags [P.], seq 776:972, ack 1, win 501, options [nop,nop,TS val 1582058889 ecr 563956083], length 196
00:20:53.854804 IP 178.128.229.39.ssh > 198.96.87.75.52485: Flags [P.], seq 972:1008, ack 1, win 501, options [nop,nop,TS val 1582058889 ecr 563956083], length 36
00:20:53.854917 IP 178.128.229.39.ssh > 198.96.87.75.52485: Flags [P.], seq 1008:1204, ack 1, win 501, options [nop,nop,TS val 1582058889 ecr 563956083], length 196
00:20:53.855005 IP 178.128.229.39.ssh > 198.96.87.75.52485: Flags [P.], seq 1204:1240, ack 1, win 501, options [nop,nop,TS val 1582058889 ecr 563956083], length 36
00:20:53.855122 IP 178.128.229.39.ssh > 198.96.87.75.52485: Flags [P.], seq 1240:1428, ack 1, win 501, options [nop,nop,TS val 1582058889 ecr 563956083], length 188
00:20:53.855245 IP 178.128.229.39.ssh > 198.96.87.75.52485: Flags [P.], seq 1428:1464, ack 1, win 501, options [nop,nop,TS val 1582058889 ecr 563956083], length 36
00:20:53.859489 IP 198.96.87.75.52485 > 178.128.229.39.ssh: Flags [.], ack 508, win 2044, options [nop,nop,TS val 563956090 ecr 1582058888], length 0
00:20:53.859490 IP 198.96.87.75.52485 > 178.128.229.39.ssh: Flags [.], ack 544, win 2044, options [nop,nop,TS val 563956090 ecr 1582058888], length 0
00:20:53.859490 IP 198.96.87.75.52485 > 178.128.229.39.ssh: Flags [.], ack 740, win 2040, options [nop,nop,TS val 563956090 ecr 1582058888], length 0
00:20:53.859490 IP 198.96.87.75.52485 > 178.128.229.39.ssh: Flags [.], ack 776, win 2040, options [nop,nop,TS val 563956090 ecr 1582058889], length 0
00:20:53.859490 IP 198.96.87.75.52485 > 178.128.229.39.ssh: Flags [.], ack 972, win 2037, options [nop,nop,TS val 563956090 ecr 1582058889], length 0
00:20:53.859490 IP 198.96.87.75.52485 > 178.128.229.39.ssh: Flags [.], ack 1008, win 2047, options [nop,nop,TS val 563956090 ecr 1582058889], length 0
00:20:53.859491 IP 198.96.87.75.52485 > 178.128.229.39.ssh: Flags [.], ack 1204, win 2044, options [nop,nop,TS val 563956090 ecr 1582058889], length 0
00:20:53.859491 IP 198.96.87.75.52485 > 178.128.229.39.ssh: Flags [.], ack 1240, win 2043, options [nop,nop,TS val 563956090 ecr 1582058889], length 0
00:20:53.859616 IP 178.128.229.39.ssh > 198.96.87.75.52485: Flags [P.], seq 1464:4040, ack 1, win 501, options [nop,nop,TS val 1582058894 ecr 563956090], length 2576
00:20:53.859666 IP 178.128.229.39.ssh > 198.96.87.75.52485: Flags [P.], seq 4040:4488, ack 1, win 501, options [nop,nop,TS val 1582058894 ecr 563956090], length 448
00:20:53.859770 IP 198.96.87.75.52485 > 178.128.229.39.ssh: Flags [.], ack 1428, win 2040, options [nop,nop,TS val 563956090 ecr 1582058889], length 0
00:20:53.859770 IP 198.96.87.75.52485 > 178.128.229.39.ssh: Flags [.], ack 1464, win 2040, options [nop,nop,TS val 563956090 ecr 1582058889], length 0
00:20:53.860013 IP 178.128.229.39.ssh > 198.96.87.75.52485: Flags [P.], seq 4488:4676, ack 1, win 501, options [nop,nop,TS val 1582058894 ecr 563956090], length 188
00:20:53.860207 IP 178.128.229.39.ssh > 198.96.87.75.52485: Flags [P.], seq 4676:4712, ack 1, win 501, options [nop,nop,TS val 1582058894 ecr 563956090], length 36
00:20:53.860502 IP 178.128.229.39.ssh > 198.96.87.75.52485: Flags [P.], seq 4712:4900, ack 1, win 501, options [nop,nop,TS val 1582058894 ecr 563956090], length 188
00:20:53.860688 IP 178.128.229.39.ssh > 198.96.87.75.52485: Flags [P.], seq 4900:4936, ack 1, win 501, options [nop,nop,TS val 1582058895 ecr 563956090], length 36
00:20:53.860913 IP 178.128.229.39.ssh > 198.96.87.75.52485: Flags [P.], seq 4936:5124, ack 1, win 501, options [nop,nop,TS val 1582058895 ecr 563956090], length 188
00:20:53.861083 IP 178.128.229.39.ssh > 198.96.87.75.52485: Flags [P.], seq 5124:5160, ack 1, win 501, options [nop,nop,TS val 1582058895 ecr 563956090], length 36
00:20:53.861310 IP 178.128.229.39.ssh > 198.96.87.75.52485: Flags [P.], seq 5160:5348, ack 1, win 501, options [nop,nop,TS val 1582058895 ecr 563956090], length 188
00:20:53.861487 IP 178.128.229.39.ssh > 198.96.87.75.52485: Flags [P.], seq 5348:5384, ack 1, win 501, options [nop,nop,TS val 1582058895 ecr 563956090], length 36
00:20:53.861671 IP 178.128.229.39.ssh > 198.96.87.75.52485: Flags [P.], seq 5384:5572, ack 1, win 501, options [nop,nop,TS val 1582058896 ecr 563956090], length 188
00:20:53.861806 IP 178.128.229.39.ssh > 198.96.87.75.52485: Flags [P.], seq 5572:5608, ack 1, win 501, options [nop,nop,TS val 1582058896 ecr 563956090], length 36
00:20:53.861984 IP 178.128.229.39.ssh > 198.96.87.75.52485: Flags [P.], seq 5608:5796, ack 1, win 501, options [nop,nop,TS val 1582058896 ecr 563956090], length 188
00:20:53.862148 IP 178.128.229.39.ssh > 198.96.87.75.52485: Flags [P.], seq 5796:5832, ack 1, win 501, options [nop,nop,TS val 1582058896 ecr 563956090], length 36
00:20:53.862380 IP 178.128.229.39.ssh > 198.96.87.75.52485: Flags [P.], seq 5832:6020, ack 1, win 501, options [nop,nop,TS val 1582058896 ecr 563956090], length 188
00:20:53.862570 IP 178.128.229.39.ssh > 198.96.87.75.52485: Flags [P.], seq 6020:6056, ack 1, win 501, options [nop,nop,TS val 1582058896 ecr 563956090], length 36
00:20:53.862802 IP 178.128.229.39.ssh > 198.96.87.75.52485: Flags [P.], seq 6056:6244, ack 1, win 501, options [nop,nop,TS val 1582058897 ecr 563956090], length 188
00:20:53.862981 IP 178.128.229.39.ssh > 198.96.87.75.52485: Flags [P.], seq 6244:6280, ack 1, win 501, options [nop,nop,TS val 1582058897 ecr 563956090], length 36
00:20:53.863209 IP 178.128.229.39.ssh > 198.96.87.75.52485: Flags [P.], seq 6280:6484, ack 1, win 501, options [nop,nop,TS val 1582058897 ecr 563956090], length 204
00:20:53.865118 IP 198.96.87.75.52485 > 178.128.229.39.ssh: Flags [.], ack 4040, win 2007, options [nop,nop,TS val 563956095 ecr 1582058894], length 0
00:20:53.865118 IP 198.96.87.75.52485 > 178.128.229.39.ssh: Flags [.], ack 4488, win 2000, options [nop,nop,TS val 563956095 ecr 1582058894], length 0
00:20:53.865167 IP 178.128.229.39.ssh > 198.96.87.75.52485: Flags [P.], seq 6484:8648, ack 1, win 501, options [nop,nop,TS val 1582058899 ecr 563956095], length 2164
00:20:53.865332 IP 198.96.87.75.52485 > 178.128.229.39.ssh: Flags [.], ack 4676, win 1997, options [nop,nop,TS val 563956095 ecr 1582058894], length 0
00:20:53.865333 IP 198.96.87.75.52485 > 178.128.229.39.ssh: Flags [.], ack 4712, win 1997, options [nop,nop,TS val 563956095 ecr 1582058894], length 0
00:20:53.865333 IP 198.96.87.75.52485 > 178.128.229.39.ssh: Flags [.], ack 4900, win 1994, options [nop,nop,TS val 563956095 ecr 1582058894], length 0
00:20:53.865333 IP 198.96.87.75.52485 > 178.128.229.39.ssh: Flags [.], ack 4936, win 1993, options [nop,nop,TS val 563956095 ecr 1582058895], length 0
00:20:53.865333 IP 198.96.87.75.52485 > 178.128.229.39.ssh: Flags [.], ack 5124, win 1990, options [nop,nop,TS val 563956095 ecr 1582058895], length 0
00:20:53.865333 IP 198.96.87.75.52485 > 178.128.229.39.ssh: Flags [.], ack 5160, win 1990, options [nop,nop,TS val 563956095 ecr 1582058895], length 0
00:20:53.865333 IP 198.96.87.75.52485 > 178.128.229.39.ssh: Flags [.], ack 5348, win 1987, options [nop,nop,TS val 563956095 ecr 1582058895], length 0
00:20:53.865333 IP 198.96.87.75.52485 > 178.128.229.39.ssh: Flags [.], ack 5348, win 2048, options [nop,nop,TS val 563956095 ecr 1582058895], length 0
00:20:53.865410 IP 198.96.87.75.52485 > 178.128.229.39.ssh: Flags [.], ack 5384, win 2047, options [nop,nop,TS val 563956095 ecr 1582058895], length 0
00:20:53.865410 IP 198.96.87.75.52485 > 178.128.229.39.ssh: Flags [.], ack 5572, win 2044, options [nop,nop,TS val 563956095 ecr 1582058896], length 0
00:20:53.865473 IP 178.128.229.39.ssh > 198.96.87.75.52485: Flags [P.], seq 8648:8852, ack 1, win 501, options [nop,nop,TS val 1582058899 ecr 563956095], length 204
00:20:53.866012 IP 178.128.229.39.ssh > 198.96.87.75.52485: Flags [P.], seq 8852:10376, ack 1, win 501, options [nop,nop,TS val 1582058900 ecr 563956095], length 1524
00:20:53.866437 IP 178.128.229.39.ssh > 198.96.87.75.52485: Flags [P.], seq 10376:11356, ack 1, win 501, options [nop,nop,TS val 1582058900 ecr 563956095], length 980
00:20:53.866866 IP 178.128.229.39.ssh > 198.96.87.75.52485: Flags [P.], seq 11356:12304, ack 1, win 501, options [nop,nop,TS val 1582058901 ecr 563956095], length 948
00:20:53.867215 IP 178.128.229.39.ssh > 198.96.87.75.52485: Flags [P.], seq 12304:12812, ack 1, win 501, options [nop,nop,TS val 1582058901 ecr 563956095], length 508
00:20:53.867383 IP 198.96.87.75.52485 > 178.128.229.39.ssh: Flags [.], ack 5608, win 2047, options [nop,nop,TS val 563956097 ecr 1582058896], length 0
00:20:53.867384 IP 198.96.87.75.52485 > 178.128.229.39.ssh: Flags [.], ack 5796, win 2044, options [nop,nop,TS val 563956097 ecr 1582058896], length 0
00:20:53.867577 IP 198.96.87.75.52485 > 178.128.229.39.ssh: Flags [.], ack 5832, win 2043, options [nop,nop,TS val 563956097 ecr 1582058896], length 0
00:20:53.867577 IP 198.96.87.75.52485 > 178.128.229.39.ssh: Flags [.], ack 6020, win 2041, options [nop,nop,TS val 563956097 ecr 1582058896], length 0
00:20:53.867577 IP 198.96.87.75.52485 > 178.128.229.39.ssh: Flags [.], ack 6056, win 2040, options [nop,nop,TS val 563956097 ecr 1582058896], length 0
00:20:53.867577 IP 198.96.87.75.52485 > 178.128.229.39.ssh: Flags [.], ack 6244, win 2037, options [nop,nop,TS val 563956097 ecr 1582058897], length 0
00:20:53.867577 IP 198.96.87.75.52485 > 178.128.229.39.ssh: Flags [.], ack 6280, win 2047, options [nop,nop,TS val 563956097 ecr 1582058897], length 0
00:20:53.867577 IP 198.96.87.75.52485 > 178.128.229.39.ssh: Flags [.], ack 6484, win 2044, options [nop,nop,TS val 563956097 ecr 1582058897], length 0
00:20:53.867687 IP 178.128.229.39.ssh > 198.96.87.75.52485: Flags [P.], seq 12812:13016, ack 1, win 501, options [nop,nop,TS val 1582058902 ecr 563956097], length 204
00:20:53.868251 IP 178.128.229.39.ssh > 198.96.87.75.52485: Flags [P.], seq 13016:14772, ack 1, win 501, options [nop,nop,TS val 1582058902 ecr 563956097], length 1756
00:20:53.868371 IP 198.96.87.75.52485 > 178.128.229.39.ssh: Flags [.], ack 8648, win 2014, options [nop,nop,TS val 563956098 ecr 1582058899], length 0
00:20:53.868615 IP 178.128.229.39.ssh > 198.96.87.75.52485: Flags [P.], seq 14772:15144, ack 1, win 501, options [nop,nop,TS val 1582058903 ecr 563956098], length 372
00:20:53.868920 IP 178.128.229.39.ssh > 198.96.87.75.52485: Flags [P.], seq 15144:15500, ack 1, win 501, options [nop,nop,TS val 1582058903 ecr 563956098], length 356
00:20:53.869179 IP 178.128.229.39.ssh > 198.96.87.75.52485: Flags [P.], seq 15500:15704, ack 1, win 501, options [nop,nop,TS val 1582058903 ecr 563956098], length 204
00:20:53.869428 IP 178.128.229.39.ssh > 198.96.87.75.52485: Flags [P.], seq 15704:15908, ack 1, win 501, options [nop,nop,TS val 1582058903 ecr 563956098], length 204
00:20:53.869649 IP 178.128.229.39.ssh > 198.96.87.75.52485: Flags [P.], seq 15908:16112, ack 1, win 501, options [nop,nop,TS val 1582058904 ecr 563956098], length 204
00:20:53.869886 IP 178.128.229.39.ssh > 198.96.87.75.52485: Flags [P.], seq 16112:16316, ack 1, win 501, options [nop,nop,TS val 1582058904 ecr 563956098], length 204
00:20:53.870515 IP 178.128.229.39.ssh > 198.96.87.75.52485: Flags [P.], seq 16316:16520, ack 1, win 501, options [nop,nop,TS val 1582058904 ecr 563956098], length 204
00:20:53.870744 IP 178.128.229.39.ssh > 198.96.87.75.52485: Flags [P.], seq 16520:16724, ack 1, win 501, options [nop,nop,TS val 1582058905 ecr 563956098], length 204
00:20:53.870853 IP 198.96.87.75.52485 > 178.128.229.39.ssh: Flags [.], ack 8852, win 2044, options [nop,nop,TS val 563956100 ecr 1582058899], length 0
00:20:53.870853 IP 198.96.87.75.52485 > 178.128.229.39.ssh: Flags [.], ack 10376, win 2021, options [nop,nop,TS val 563956100 ecr 1582058900], length 0
00:20:53.870853 IP 198.96.87.75.52485 > 178.128.229.39.ssh: Flags [.], ack 11356, win 2005, options [nop,nop,TS val 563956100 ecr 1582058900], length 0
00:20:53.870853 IP 198.96.87.75.52485 > 178.128.229.39.ssh: Flags [.], ack 12304, win 1990, options [nop,nop,TS val 563956100 ecr 1582058901], length 0
00:20:53.871040 IP 178.128.229.39.ssh > 198.96.87.75.52485: Flags [P.], seq 16724:16928, ack 1, win 501, options [nop,nop,TS val 1582058905 ecr 563956100], length 204
00:20:53.871336 IP 178.128.229.39.ssh > 198.96.87.75.52485: Flags [P.], seq 16928:17420, ack 1, win 501, options [nop,nop,TS val 1582058905 ecr 563956100], length 492
00:20:53.871628 IP 178.128.229.39.ssh > 198.96.87.75.52485: Flags [P.], seq 17420:17776, ack 1, win 501, options [nop,nop,TS val 1582058906 ecr 563956100], length 356
00:20:53.871752 IP 198.96.87.75.52485 > 178.128.229.39.ssh: Flags [.], ack 12812, win 1986, options [nop,nop,TS val 563956100 ecr 1582058901], length 0
00:20:53.871752 IP 198.96.87.75.52485 > 178.128.229.39.ssh: Flags [.], ack 12812, win 2048, options [nop,nop,TS val 563956100 ecr 1582058901], length 0
00:20:53.871752 IP 198.96.87.75.52485 > 178.128.229.39.ssh: Flags [.], ack 13016, win 2044, options [nop,nop,TS val 563956100 ecr 1582058902], length 0
00:20:53.871752 IP 198.96.87.75.52485 > 178.128.229.39.ssh: Flags [P.], seq 1:37, ack 13016, win 2048, options [nop,nop,TS val 563956100 ecr 1582058902], length 36
00:20:53.871945 IP 178.128.229.39.ssh > 198.96.87.75.52485: Flags [P.], seq 17776:17980, ack 37, win 501, options [nop,nop,TS val 1582058906 ecr 563956100], length 204
00:20:53.872219 IP 178.128.229.39.ssh > 198.96.87.75.52485: Flags [P.], seq 17980:18488, ack 37, win 501, options [nop,nop,TS val 1582058906 ecr 563956100], length 508
00:20:53.872521 IP 178.128.229.39.ssh > 198.96.87.75.52485: Flags [P.], seq 18488:19012, ack 37, win 501, options [nop,nop,TS val 1582058906 ecr 563956100], length 524
00:20:53.872800 IP 178.128.229.39.ssh > 198.96.87.75.52485: Flags [P.], seq 19012:19392, ack 37, win 501, options [nop,nop,TS val 1582058907 ecr 563956100], length 380
00:20:53.873004 IP 178.128.229.39.ssh > 198.96.87.75.52485: Flags [P.], seq 19392:19596, ack 37, win 501, options [nop,nop,TS val 1582058907 ecr 563956100], length 204
00:20:53.873222 IP 178.128.229.39.ssh > 198.96.87.75.52485: Flags [P.], seq 19596:19800, ack 37, win 501, options [nop,nop,TS val 1582058907 ecr 563956100], length 204
00:20:53.873459 IP 178.128.229.39.ssh > 198.96.87.75.52485: Flags [P.], seq 19800:20004, ack 37, win 501, options [nop,nop,TS val 1582058907 ecr 563956100], length 204
00:20:53.873698 IP 178.128.229.39.ssh > 198.96.87.75.52485: Flags [P.], seq 20004:20208, ack 37, win 501, options [nop,nop,TS val 1582058908 ecr 563956100], length 204
00:20:53.873957 IP 178.128.229.39.ssh > 198.96.87.75.52485: Flags [P.], seq 20208:20412, ack 37, win 501, options [nop,nop,TS val 1582058908 ecr 563956100], length 204
00:20:53.874194 IP 178.128.229.39.ssh > 198.96.87.75.52485: Flags [P.], seq 20412:20616, ack 37, win 501, options [nop,nop,TS val 1582058908 ecr 563956100], length 204
00:20:53.874367 IP 198.96.87.75.52485 > 178.128.229.39.ssh: Flags [.], ack 14772, win 2020, options [nop,nop,TS val 563956102 ecr 1582058902], length 0
00:20:53.874368 IP 198.96.87.75.52485 > 178.128.229.39.ssh: Flags [.], ack 15144, win 2014, options [nop,nop,TS val 563956102 ecr 1582058903], length 0
00:20:53.874368 IP 198.96.87.75.52485 > 178.128.229.39.ssh: Flags [.], ack 15500, win 2009, options [nop,nop,TS val 563956102 ecr 1582058903], length 0
00:20:53.874368 IP 198.96.87.75.52485 > 178.128.229.39.ssh: Flags [.], ack 15704, win 2006, options [nop,nop,TS val 563956102 ecr 1582058903], length 0
00:20:53.874368 IP 198.96.87.75.52485 > 178.128.229.39.ssh: Flags [.], ack 15908, win 2002, options [nop,nop,TS val 563956102 ecr 1582058903], length 0
00:20:53.874432 IP 198.96.87.75.52485 > 178.128.229.39.ssh: Flags [.], ack 16112, win 1999, options [nop,nop,TS val 563956102 ecr 1582058904], length 0
00:20:53.874433 IP 198.96.87.75.52485 > 178.128.229.39.ssh: Flags [.], ack 16316, win 1996, options [nop,nop,TS val 563956102 ecr 1582058904], length 0
00:20:53.874433 IP 198.96.87.75.52485 > 178.128.229.39.ssh: Flags [.], ack 16316, win 2048, options [nop,nop,TS val 563956102 ecr 1582058904], length 0
00:20:53.874433 IP 198.96.87.75.52485 > 178.128.229.39.ssh: Flags [.], ack 16520, win 2044, options [nop,nop,TS val 563956102 ecr 1582058904], length 0
00:20:53.874433 IP 198.96.87.75.52485 > 178.128.229.39.ssh: Flags [.], ack 16724, win 2041, options [nop,nop,TS val 563956102 ecr 1582058905], length 0
00:20:53.874433 IP 198.96.87.75.52485 > 178.128.229.39.ssh: Flags [.], ack 16928, win 2038, options [nop,nop,TS val 563956102 ecr 1582058905], length 0
00:20:53.875045 IP 178.128.229.39.ssh > 198.96.87.75.52485: Flags [P.], seq 20616:22500, ack 37, win 501, options [nop,nop,TS val 1582058909 ecr 563956102], length 1884
00:20:53.875286 IP 178.128.229.39.ssh > 198.96.87.75.52485: Flags [P.], seq 22500:22712, ack 37, win 501, options [nop,nop,TS val 1582058909 ecr 563956102], length 212
00:20:53.875569 IP 178.128.229.39.ssh > 198.96.87.75.52485: Flags [P.], seq 22712:22916, ack 37, win 501, options [nop,nop,TS val 1582058909 ecr 563956102], length 204
00:20:53.875825 IP 178.128.229.39.ssh > 198.96.87.75.52485: Flags [P.], seq 22916:23120, ack 37, win 501, options [nop,nop,TS val 1582058910 ecr 563956102], length 204
00:20:53.875950 IP 198.96.87.75.52485 > 178.128.229.39.ssh: Flags [.], ack 17420, win 2040, options [nop,nop,TS val 563956104 ecr 1582058905], length 0
00:20:53.875950 IP 198.96.87.75.52485 > 178.128.229.39.ssh: Flags [.], ack 17776, win 2034, options [nop,nop,TS val 563956104 ecr 1582058906], length 0
00:20:53.875950 IP 198.96.87.75.52485 > 178.128.229.39.ssh: Flags [.], ack 17980, win 2031, options [nop,nop,TS val 563956104 ecr 1582058906], length 0
00:20:53.876261 IP 178.128.229.39.ssh > 198.96.87.75.52485: Flags [P.], seq 23120:23788, ack 37, win 501, options [nop,nop,TS val 1582058910 ecr 563956104], length 668
00:20:53.876546 IP 178.128.229.39.ssh > 198.96.87.75.52485: Flags [P.], seq 23788:23992, ack 37, win 501, options [nop,nop,TS val 1582058910 ecr 563956104], length 204
00:20:53.876784 IP 178.128.229.39.ssh > 198.96.87.75.52485: Flags [P.], seq 23992:24196, ack 37, win 501, options [nop,nop,TS val 1582058911 ecr 563956104], length 204
00:20:53.877030 IP 178.128.229.39.ssh > 198.96.87.75.52485: Flags [P.], seq 24196:24400, ack 37, win 501, options [nop,nop,TS val 1582058911 ecr 563956104], length 204
00:20:53.877269 IP 178.128.229.39.ssh > 198.96.87.75.52485: Flags [P.], seq 24400:24604, ack 37, win 501, options [nop,nop,TS val 1582058911 ecr 563956104], length 204
00:20:53.877511 IP 178.128.229.39.ssh > 198.96.87.75.52485: Flags [P.], seq 24604:24808, ack 37, win 501, options [nop,nop,TS val 1582058911 ecr 563956104], length 204
00:20:53.877746 IP 178.128.229.39.ssh > 198.96.87.75.52485: Flags [P.], seq 24808:25012, ack 37, win 501, options [nop,nop,TS val 1582058912 ecr 563956104], length 204
00:20:53.878001 IP 178.128.229.39.ssh > 198.96.87.75.52485: Flags [P.], seq 25012:25216, ack 37, win 501, options [nop,nop,TS val 1582058912 ecr 563956104], length 204
00:20:53.878245 IP 178.128.229.39.ssh > 198.96.87.75.52485: Flags [P.], seq 25216:25420, ack 37, win 501, options [nop,nop,TS val 1582058912 ecr 563956104], length 204
00:20:53.878510 IP 178.128.229.39.ssh > 198.96.87.75.52485: Flags [P.], seq 25420:25624, ack 37, win 501, options [nop,nop,TS val 1582058912 ecr 563956104], length 204
00:20:53.878749 IP 178.128.229.39.ssh > 198.96.87.75.52485: Flags [P.], seq 25624:25828, ack 37, win 501, options [nop,nop,TS val 1582058913 ecr 563956104], length 204
00:20:53.878973 IP 198.96.87.75.52485 > 178.128.229.39.ssh: Flags [.], ack 18488, win 2040, options [nop,nop,TS val 563956106 ecr 1582058906], length 0
00:20:53.878973 IP 198.96.87.75.52485 > 178.128.229.39.ssh: Flags [.], ack 19012, win 2031, options [nop,nop,TS val 563956106 ecr 1582058906], length 0
00:20:53.878973 IP 198.96.87.75.52485 > 178.128.229.39.ssh: Flags [.], ack 19392, win 2025, options [nop,nop,TS val 563956106 ecr 1582058907], length 0
00:20:53.878973 IP 198.96.87.75.52485 > 178.128.229.39.ssh: Flags [.], ack 19596, win 2022, options [nop,nop,TS val 563956106 ecr 1582058907], length 0
00:20:53.878974 IP 198.96.87.75.52485 > 178.128.229.39.ssh: Flags [.], ack 19800, win 2019, options [nop,nop,TS val 563956106 ecr 1582058907], length 0
00:20:53.878974 IP 198.96.87.75.52485 > 178.128.229.39.ssh: Flags [.], ack 20004, win 2016, options [nop,nop,TS val 563956106 ecr 1582058907], length 0
00:20:53.878974 IP 198.96.87.75.52485 > 178.128.229.39.ssh: Flags [.], ack 20208, win 2013, options [nop,nop,TS val 563956106 ecr 1582058908], length 0
00:20:53.878974 IP 198.96.87.75.52485 > 178.128.229.39.ssh: Flags [.], ack 20412, win 2010, options [nop,nop,TS val 563956106 ecr 1582058908], length 0
00:20:53.879059 IP 198.96.87.75.52485 > 178.128.229.39.ssh: Flags [.], ack 20616, win 2006, options [nop,nop,TS val 563956106 ecr 1582058908], length 0
00:20:53.879059 IP 198.96.87.75.52485 > 178.128.229.39.ssh: Flags [.], ack 20616, win 2048, options [nop,nop,TS val 563956106 ecr 1582058908], length 0
00:20:53.879156 IP 178.128.229.39.ssh > 198.96.87.75.52485: Flags [P.], seq 25828:26032, ack 37, win 501, options [nop,nop,TS val 1582058913 ecr 563956106], length 204
00:20:53.879769 IP 178.128.229.39.ssh > 198.96.87.75.52485: Flags [P.], seq 26032:27772, ack 37, win 501, options [nop,nop,TS val 1582058914 ecr 563956106], length 1740
00:20:53.879999 IP 178.128.229.39.ssh > 198.96.87.75.52485: Flags [P.], seq 27772:27976, ack 37, win 501, options [nop,nop,TS val 1582058914 ecr 563956106], length 204
00:20:53.880237 IP 178.128.229.39.ssh > 198.96.87.75.52485: Flags [P.], seq 27976:28180, ack 37, win 501, options [nop,nop,TS val 1582058914 ecr 563956106], length 204
00:20:53.880525 IP 178.128.229.39.ssh > 198.96.87.75.52485: Flags [P.], seq 28180:28384, ack 37, win 501, options [nop,nop,TS val 1582058914 ecr 563956106], length 204
00:20:53.880793 IP 178.128.229.39.ssh > 198.96.87.75.52485: Flags [P.], seq 28384:28588, ack 37, win 501, options [nop,nop,TS val 1582058915 ecr 563956106], length 204
00:20:53.881034 IP 178.128.229.39.ssh > 198.96.87.75.52485: Flags [P.], seq 28588:28792, ack 37, win 501, options [nop,nop,TS val 1582058915 ecr 563956106], length 204
00:20:53.881289 IP 178.128.229.39.ssh > 198.96.87.75.52485: Flags [P.], seq 28792:28996, ack 37, win 501, options [nop,nop,TS val 1582058915 ecr 563956106], length 204
00:20:53.881525 IP 178.128.229.39.ssh > 198.96.87.75.52485: Flags [P.], seq 28996:29200, ack 37, win 501, options [nop,nop,TS val 1582058915 ecr 563956106], length 204
00:20:53.881769 IP 178.128.229.39.ssh > 198.96.87.75.52485: Flags [P.], seq 29200:29404, ack 37, win 501, options [nop,nop,TS val 1582058916 ecr 563956106], length 204
00:20:53.882006 IP 178.128.229.39.ssh > 198.96.87.75.52485: Flags [P.], seq 29404:29608, ack 37, win 501, options [nop,nop,TS val 1582058916 ecr 563956106], length 204
00:20:53.882246 IP 178.128.229.39.ssh > 198.96.87.75.52485: Flags [P.], seq 29608:29812, ack 37, win 501, options [nop,nop,TS val 1582058916 ecr 563956106], length 204
00:20:53.882492 IP 178.128.229.39.ssh > 198.96.87.75.52485: Flags [P.], seq 29812:30016, ack 37, win 501, options [nop,nop,TS val 1582058916 ecr 563956106], length 204
00:20:53.882714 IP 178.128.229.39.ssh > 198.96.87.75.52485: Flags [P.], seq 30016:30220, ack 37, win 501, options [nop,nop,TS val 1582058917 ecr 563956106], length 204
00:20:53.882906 IP 178.128.229.39.ssh > 198.96.87.75.52485: Flags [P.], seq 30220:30424, ack 37, win 501, options [nop,nop,TS val 1582058917 ecr 563956106], length 204
00:20:53.883061 IP 178.128.229.39.ssh > 198.96.87.75.52485: Flags [P.], seq 30424:30628, ack 37, win 501, options [nop,nop,TS val 1582058917 ecr 563956106], length 204
00:20:53.883235 IP 178.128.229.39.ssh > 198.96.87.75.52485: Flags [P.], seq 30628:30832, ack 37, win 501, options [nop,nop,TS val 1582058917 ecr 563956106], length 204
00:20:53.883374 IP 178.128.229.39.ssh > 198.96.87.75.52485: Flags [P.], seq 30832:31036, ack 37, win 501, options [nop,nop,TS val 1582058917 ecr 563956106], length 204
00:20:53.883503 IP 178.128.229.39.ssh > 198.96.87.75.52485: Flags [P.], seq 31036:31240, ack 37, win 501, options [nop,nop,TS val 1582058917 ecr 563956106], length 204
00:20:53.883734 IP 178.128.229.39.ssh > 198.96.87.75.52485: Flags [P.], seq 31240:31444, ack 37, win 501, options [nop,nop,TS val 1582058918 ecr 563956106], length 204
00:20:53.883867 IP 178.128.229.39.ssh > 198.96.87.75.52485: Flags [P.], seq 31444:31648, ack 37, win 501, options [nop,nop,TS val 1582058918 ecr 563956106], length 204
00:20:53.883996 IP 178.128.229.39.ssh > 198.96.87.75.52485: Flags [P.], seq 31648:31852, ack 37, win 501, options [nop,nop,TS val 1582058918 ecr 563956106], length 204
00:20:53.884167 IP 178.128.229.39.ssh > 198.96.87.75.52485: Flags [P.], seq 31852:32056, ack 37, win 501, options [nop,nop,TS val 1582058918 ecr 563956106], length 204
00:20:53.884309 IP 178.128.229.39.ssh > 198.96.87.75.52485: Flags [P.], seq 32056:32260, ack 37, win 501, options [nop,nop,TS val 1582058918 ecr 563956106], length 204
00:20:53.884468 IP 178.128.229.39.ssh > 198.96.87.75.52485: Flags [P.], seq 32260:32464, ack 37, win 501, options [nop,nop,TS val 1582058918 ecr 563956106], length 204
00:20:53.884600 IP 178.128.229.39.ssh > 198.96.87.75.52485: Flags [P.], seq 32464:32668, ack 37, win 501, options [nop,nop,TS val 1582058919 ecr 563956106], length 204
00:20:53.884731 IP 178.128.229.39.ssh > 198.96.87.75.52485: Flags [P.], seq 32668:32872, ack 37, win 501, options [nop,nop,TS val 1582058919 ecr 563956106], length 204
00:20:53.884879 IP 178.128.229.39.ssh > 198.96.87.75.52485: Flags [P.], seq 32872:33076, ack 37, win 501, options [nop,nop,TS val 1582058919 ecr 563956106], length 204
00:20:53.885011 IP 178.128.229.39.ssh > 198.96.87.75.52485: Flags [P.], seq 33076:33280, ack 37, win 501, options [nop,nop,TS val 1582058919 ecr 563956106], length 204
00:20:53.885188 IP 178.128.229.39.ssh > 198.96.87.75.52485: Flags [P.], seq 33280:33484, ack 37, win 501, options [nop,nop,TS val 1582058919 ecr 563956106], length 204
00:20:53.885330 IP 178.128.229.39.ssh > 198.96.87.75.52485: Flags [P.], seq 33484:33688, ack 37, win 501, options [nop,nop,TS val 1582058919 ecr 563956106], length 204
00:20:53.885457 IP 178.128.229.39.ssh > 198.96.87.75.52485: Flags [P.], seq 33688:33892, ack 37, win 501, options [nop,nop,TS val 1582058919 ecr 563956106], length 204
00:20:53.885590 IP 178.128.229.39.ssh > 198.96.87.75.52485: Flags [P.], seq 33892:34096, ack 37, win 501, options [nop,nop,TS val 1582058920 ecr 563956106], length 204
00:20:53.891628 IP 198.96.87.75.52485 > 178.128.229.39.ssh: Flags [.], ack 22500, win 2018, options [nop,nop,TS val 563956116 ecr 1582058909], length 0
00:20:53.891628 IP 198.96.87.75.52485 > 178.128.229.39.ssh: Flags [.], ack 22712, win 2015, options [nop,nop,TS val 563956116 ecr 1582058909], length 0
00:20:53.891628 IP 198.96.87.75.52485 > 178.128.229.39.ssh: Flags [.], ack 22916, win 2012, options [nop,nop,TS val 563956116 ecr 1582058909], length 0
00:20:53.891629 IP 198.96.87.75.52485 > 178.128.229.39.ssh: Flags [.], ack 23120, win 2008, options [nop,nop,TS val 563956116 ecr 1582058910], length 0
00:20:53.891629 IP 198.96.87.75.52485 > 178.128.229.39.ssh: Flags [.], ack 23788, win 1998, options [nop,nop,TS val 563956116 ecr 1582058910], length 0
00:20:53.891629 IP 198.96.87.75.52485 > 178.128.229.39.ssh: Flags [.], ack 23992, win 1995, options [nop,nop,TS val 563956116 ecr 1582058910], length 0
00:20:53.891629 IP 198.96.87.75.52485 > 178.128.229.39.ssh: Flags [.], ack 24196, win 1992, options [nop,nop,TS val 563956116 ecr 1582058911], length 0
00:20:53.891629 IP 198.96.87.75.52485 > 178.128.229.39.ssh: Flags [.], ack 24400, win 1988, options [nop,nop,TS val 563956116 ecr 1582058911], length 0
00:20:53.891712 IP 178.128.229.39.ssh > 198.96.87.75.52485: Flags [P.], seq 34096:34300, ack 37, win 501, options [nop,nop,TS val 1582058926 ecr 563956116], length 204
00:20:53.891800 IP 198.96.87.75.52485 > 178.128.229.39.ssh: Flags [.], ack 24604, win 1985, options [nop,nop,TS val 563956116 ecr 1582058911], length 0
00:20:53.891801 IP 198.96.87.75.52485 > 178.128.229.39.ssh: Flags [.], ack 24808, win 1982, options [nop,nop,TS val 563956116 ecr 1582058911], length 0
00:20:53.891801 IP 198.96.87.75.52485 > 178.128.229.39.ssh: Flags [.], ack 24808, win 2048, options [nop,nop,TS val 563956116 ecr 1582058911], length 0
00:20:53.891801 IP 198.96.87.75.52485 > 178.128.229.39.ssh: Flags [.], ack 25012, win 2044, options [nop,nop,TS val 563956116 ecr 1582058912], length 0
00:20:53.891801 IP 198.96.87.75.52485 > 178.128.229.39.ssh: Flags [.], ack 25216, win 2041, options [nop,nop,TS val 563956116 ecr 1582058912], length 0
00:20:53.891801 IP 198.96.87.75.52485 > 178.128.229.39.ssh: Flags [.], ack 25420, win 2038, options [nop,nop,TS val 563956116 ecr 1582058912], length 0
00:20:53.891801 IP 198.96.87.75.52485 > 178.128.229.39.ssh: Flags [.], ack 25624, win 2035, options [nop,nop,TS val 563956116 ecr 1582058912], length 0
00:20:53.891801 IP 198.96.87.75.52485 > 178.128.229.39.ssh: Flags [.], ack 25828, win 2032, options [nop,nop,TS val 563956116 ecr 1582058913], length 0
00:20:53.891866 IP 198.96.87.75.52485 > 178.128.229.39.ssh: Flags [.], ack 26032, win 2028, options [nop,nop,TS val 563956116 ecr 1582058913], length 0
00:20:53.891866 IP 198.96.87.75.52485 > 178.128.229.39.ssh: Flags [.], ack 27772, win 2001, options [nop,nop,TS val 563956116 ecr 1582058914], length 0
00:20:53.891866 IP 198.96.87.75.52485 > 178.128.229.39.ssh: Flags [.], ack 27976, win 1998, options [nop,nop,TS val 563956116 ecr 1582058914], length 0
00:20:53.891866 IP 198.96.87.75.52485 > 178.128.229.39.ssh: Flags [.], ack 28180, win 1995, options [nop,nop,TS val 563956116 ecr 1582058914], length 0
00:20:53.891866 IP 198.96.87.75.52485 > 178.128.229.39.ssh: Flags [.], ack 28384, win 1992, options [nop,nop,TS val 563956116 ecr 1582058914], length 0
00:20:53.891866 IP 198.96.87.75.52485 > 178.128.229.39.ssh: Flags [.], ack 28588, win 1988, options [nop,nop,TS val 563956116 ecr 1582058915], length 0
00:20:53.891867 IP 198.96.87.75.52485 > 178.128.229.39.ssh: Flags [.], ack 28792, win 1985, options [nop,nop,TS val 563956116 ecr 1582058915], length 0
00:20:53.891867 IP 198.96.87.75.52485 > 178.128.229.39.ssh: Flags [.], ack 28996, win 1982, options [nop,nop,TS val 563956116 ecr 1582058915], length 0
00:20:53.891935 IP 198.96.87.75.52485 > 178.128.229.39.ssh: Flags [.], ack 29200, win 1979, options [nop,nop,TS val 563956116 ecr 1582058915], length 0
00:20:53.891935 IP 198.96.87.75.52485 > 178.128.229.39.ssh: Flags [.], ack 29404, win 1976, options [nop,nop,TS val 563956116 ecr 1582058916], length 0
00:20:53.891935 IP 198.96.87.75.52485 > 178.128.229.39.ssh: Flags [.], ack 29608, win 1973, options [nop,nop,TS val 563956116 ecr 1582058916], length 0
00:20:53.891936 IP 198.96.87.75.52485 > 178.128.229.39.ssh: Flags [.], ack 29812, win 1969, options [nop,nop,TS val 563956116 ecr 1582058916], length 0
00:20:53.891936 IP 198.96.87.75.52485 > 178.128.229.39.ssh: Flags [.], ack 30016, win 1966, options [nop,nop,TS val 563956116 ecr 1582058916], length 0
00:20:53.891936 IP 198.96.87.75.52485 > 178.128.229.39.ssh: Flags [.], ack 30220, win 1963, options [nop,nop,TS val 563956116 ecr 1582058917], length 0
00:20:53.891936 IP 198.96.87.75.52485 > 178.128.229.39.ssh: Flags [.], ack 30424, win 1960, options [nop,nop,TS val 563956116 ecr 1582058917], length 0
00:20:53.893444 IP 178.128.229.39.ssh > 198.96.87.75.52485: Flags [P.], seq 34300:38432, ack 37, win 501, options [nop,nop,TS val 1582058927 ecr 563956117], length 4132
00:20:53.893580 IP 178.128.229.39.ssh > 198.96.87.75.52485: Flags [P.], seq 38432:39284, ack 37, win 501, options [nop,nop,TS val 1582058927 ecr 563956117], length 852
00:20:53.893869 IP 178.128.229.39.ssh > 198.96.87.75.52485: Flags [P.], seq 39284:39664, ack 37, win 501, options [nop,nop,TS val 1582058928 ecr 563956117], length 380
00:20:53.894064 IP 178.128.229.39.ssh > 198.96.87.75.52485: Flags [P.], seq 39664:39868, ack 37, win 501, options [nop,nop,TS val 1582058928 ecr 563956117], length 204
00:20:53.894202 IP 178.128.229.39.ssh > 198.96.87.75.52485: Flags [P.], seq 39868:40072, ack 37, win 501, options [nop,nop,TS val 1582058928 ecr 563956117], length 204
00:20:53.894333 IP 178.128.229.39.ssh > 198.96.87.75.52485: Flags [P.], seq 40072:40276, ack 37, win 501, options [nop,nop,TS val 1582058928 ecr 563956117], length 204
00:20:53.894462 IP 178.128.229.39.ssh > 198.96.87.75.52485: Flags [P.], seq 40276:40480, ack 37, win 501, options [nop,nop,TS val 1582058928 ecr 563956117], length 204
00:20:53.894589 IP 178.128.229.39.ssh > 198.96.87.75.52485: Flags [P.], seq 40480:40684, ack 37, win 501, options [nop,nop,TS val 1582058929 ecr 563956117], length 204
00:20:53.894718 IP 178.128.229.39.ssh > 198.96.87.75.52485: Flags [P.], seq 40684:40888, ack 37, win 501, options [nop,nop,TS val 1582058929 ecr 563956117], length 204
00:20:53.894847 IP 178.128.229.39.ssh > 198.96.87.75.52485: Flags [P.], seq 40888:41092, ack 37, win 501, options [nop,nop,TS val 1582058929 ecr 563956117], length 204
00:20:53.894976 IP 178.128.229.39.ssh > 198.96.87.75.52485: Flags [P.], seq 41092:41296, ack 37, win 501, options [nop,nop,TS val 1582058929 ecr 563956117], length 204
00:20:53.895103 IP 178.128.229.39.ssh > 198.96.87.75.52485: Flags [P.], seq 41296:41500, ack 37, win 501, options [nop,nop,TS val 1582058929 ecr 563956117], length 204
00:20:53.895236 IP 178.128.229.39.ssh > 198.96.87.75.52485: Flags [P.], seq 41500:41704, ack 37, win 501, options [nop,nop,TS val 1582058929 ecr 563956117], length 204
00:20:53.895366 IP 178.128.229.39.ssh > 198.96.87.75.52485: Flags [P.], seq 41704:41908, ack 37, win 501, options [nop,nop,TS val 1582058929 ecr 563956117], length 204
00:20:53.895494 IP 178.128.229.39.ssh > 198.96.87.75.52485: Flags [P.], seq 41908:42112, ack 37, win 501, options [nop,nop,TS val 1582058929 ecr 563956117], length 204
00:20:53.895653 IP 178.128.229.39.ssh > 198.96.87.75.52485: Flags [P.], seq 42112:42316, ack 37, win 501, options [nop,nop,TS val 1582058930 ecr 563956117], length 204
00:20:53.895786 IP 178.128.229.39.ssh > 198.96.87.75.52485: Flags [P.], seq 42316:42520, ack 37, win 501, options [nop,nop,TS val 1582058930 ecr 563956117], length 204
00:20:53.895917 IP 178.128.229.39.ssh > 198.96.87.75.52485: Flags [P.], seq 42520:42724, ack 37, win 501, options [nop,nop,TS val 1582058930 ecr 563956117], length 204
00:20:53.896072 IP 178.128.229.39.ssh > 198.96.87.75.52485: Flags [P.], seq 42724:42928, ack 37, win 501, options [nop,nop,TS val 1582058930 ecr 563956117], length 204
00:20:53.896207 IP 178.128.229.39.ssh > 198.96.87.75.52485: Flags [P.], seq 42928:43132, ack 37, win 501, options [nop,nop,TS val 1582058930 ecr 563956117], length 204
00:20:53.896248 IP 198.96.87.75.52485 > 178.128.229.39.ssh: Flags [.], ack 34300, win 2044, options [nop,nop,TS val 563956123 ecr 1582058926], length 0
00:20:53.896395 IP 178.128.229.39.ssh > 198.96.87.75.52485: Flags [P.], seq 43132:43488, ack 37, win 501, options [nop,nop,TS val 1582058930 ecr 563956123], length 356
00:20:53.896553 IP 178.128.229.39.ssh > 198.96.87.75.52485: Flags [P.], seq 43488:43692, ack 37, win 501, options [nop,nop,TS val 1582058930 ecr 563956123], length 204
00:20:53.896715 IP 178.128.229.39.ssh > 198.96.87.75.52485: Flags [P.], seq 43692:43896, ack 37, win 501, options [nop,nop,TS val 1582058931 ecr 563956123], length 204
00:20:53.896842 IP 178.128.229.39.ssh > 198.96.87.75.52485: Flags [P.], seq 43896:44100, ack 37, win 501, options [nop,nop,TS val 1582058931 ecr 563956123], length 204
00:20:53.896973 IP 178.128.229.39.ssh > 198.96.87.75.52485: Flags [P.], seq 44100:44304, ack 37, win 501, options [nop,nop,TS val 1582058931 ecr 563956123], length 204
00:20:53.897106 IP 178.128.229.39.ssh > 198.96.87.75.52485: Flags [P.], seq 44304:44508, ack 37, win 501, options [nop,nop,TS val 1582058931 ecr 563956123], length 204
00:20:53.897236 IP 178.128.229.39.ssh > 198.96.87.75.52485: Flags [P.], seq 44508:44712, ack 37, win 501, options [nop,nop,TS val 1582058931 ecr 563956123], length 204
00:20:53.897364 IP 178.128.229.39.ssh > 198.96.87.75.52485: Flags [P.], seq 44712:44916, ack 37, win 501, options [nop,nop,TS val 1582058931 ecr 563956123], length 204
00:20:53.897494 IP 178.128.229.39.ssh > 198.96.87.75.52485: Flags [P.], seq 44916:45120, ack 37, win 501, options [nop,nop,TS val 1582058931 ecr 563956123], length 204
00:20:53.897623 IP 178.128.229.39.ssh > 198.96.87.75.52485: Flags [P.], seq 45120:45324, ack 37, win 501, options [nop,nop,TS val 1582058932 ecr 563956123], length 204
00:20:53.897748 IP 178.128.229.39.ssh > 198.96.87.75.52485: Flags [P.], seq 45324:45528, ack 37, win 501, options [nop,nop,TS val 1582058932 ecr 563956123], length 204
00:20:53.897883 IP 178.128.229.39.ssh > 198.96.87.75.52485: Flags [P.], seq 45528:45732, ack 37, win 501, options [nop,nop,TS val 1582058932 ecr 563956123], length 204
00:20:53.898010 IP 178.128.229.39.ssh > 198.96.87.75.52485: Flags [P.], seq 45732:45936, ack 37, win 501, options [nop,nop,TS val 1582058932 ecr 563956123], length 204
00:20:53.898138 IP 178.128.229.39.ssh > 198.96.87.75.52485: Flags [P.], seq 45936:46140, ack 37, win 501, options [nop,nop,TS val 1582058932 ecr 563956123], length 204
00:20:53.898267 IP 178.128.229.39.ssh > 198.96.87.75.52485: Flags [P.], seq 46140:46344, ack 37, win 501, options [nop,nop,TS val 1582058932 ecr 563956123], length 204
00:20:53.898395 IP 178.128.229.39.ssh > 198.96.87.75.52485: Flags [P.], seq 46344:46548, ack 37, win 501, options [nop,nop,TS val 1582058932 ecr 563956123], length 204
00:20:53.898523 IP 178.128.229.39.ssh > 198.96.87.75.52485: Flags [P.], seq 46548:46752, ack 37, win 501, options [nop,nop,TS val 1582058932 ecr 563956123], length 204
00:20:53.898723 IP 178.128.229.39.ssh > 198.96.87.75.52485: Flags [P.], seq 46752:46956, ack 37, win 501, options [nop,nop,TS val 1582058933 ecr 563956123], length 204
00:20:53.898867 IP 178.128.229.39.ssh > 198.96.87.75.52485: Flags [P.], seq 46956:47160, ack 37, win 501, options [nop,nop,TS val 1582058933 ecr 563956123], length 204
00:20:53.899012 IP 178.128.229.39.ssh > 198.96.87.75.52485: Flags [P.], seq 47160:47364, ack 37, win 501, options [nop,nop,TS val 1582058933 ecr 563956123], length 204
00:20:53.899141 IP 178.128.229.39.ssh > 198.96.87.75.52485: Flags [P.], seq 47364:47568, ack 37, win 501, options [nop,nop,TS val 1582058933 ecr 563956123], length 204
00:20:53.899275 IP 178.128.229.39.ssh > 198.96.87.75.52485: Flags [P.], seq 47568:47772, ack 37, win 501, options [nop,nop,TS val 1582058933 ecr 563956123], length 204
00:20:53.899407 IP 178.128.229.39.ssh > 198.96.87.75.52485: Flags [P.], seq 47772:47976, ack 37, win 501, options [nop,nop,TS val 1582058933 ecr 563956123], length 204
00:20:53.899588 IP 178.128.229.39.ssh > 198.96.87.75.52485: Flags [P.], seq 47976:48180, ack 37, win 501, options [nop,nop,TS val 1582058934 ecr 563956123], length 204
00:20:53.899723 IP 178.128.229.39.ssh > 198.96.87.75.52485: Flags [P.], seq 48180:48384, ack 37, win 501, options [nop,nop,TS val 1582058934 ecr 563956123], length 204
00:20:53.899852 IP 178.128.229.39.ssh > 198.96.87.75.52485: Flags [P.], seq 48384:48588, ack 37, win 501, options [nop,nop,TS val 1582058934 ecr 563956123], length 204
00:20:53.899983 IP 178.128.229.39.ssh > 198.96.87.75.52485: Flags [P.], seq 48588:48792, ack 37, win 501, options [nop,nop,TS val 1582058934 ecr 563956123], length 204
00:20:53.900118 IP 178.128.229.39.ssh > 198.96.87.75.52485: Flags [P.], seq 48792:48996, ack 37, win 501, options [nop,nop,TS val 1582058934 ecr 563956123], length 204
00:20:53.900256 IP 178.128.229.39.ssh > 198.96.87.75.52485: Flags [P.], seq 48996:49200, ack 37, win 501, options [nop,nop,TS val 1582058934 ecr 563956123], length 204
00:20:53.900384 IP 178.128.229.39.ssh > 198.96.87.75.52485: Flags [P.], seq 49200:49404, ack 37, win 501, options [nop,nop,TS val 1582058934 ecr 563956123], length 204
00:20:53.900537 IP 178.128.229.39.ssh > 198.96.87.75.52485: Flags [P.], seq 49404:49608, ack 37, win 501, options [nop,nop,TS val 1582058934 ecr 563956123], length 204
00:20:53.900679 IP 178.128.229.39.ssh > 198.96.87.75.52485: Flags [P.], seq 49608:49812, ack 37, win 501, options [nop,nop,TS val 1582058935 ecr 563956123], length 204
00:20:53.900815 IP 178.128.229.39.ssh > 198.96.87.75.52485: Flags [P.], seq 49812:50016, ack 37, win 501, options [nop,nop,TS val 1582058935 ecr 563956123], length 204
00:20:53.901053 IP 178.128.229.39.ssh > 198.96.87.75.52485: Flags [P.], seq 50016:50220, ack 37, win 501, options [nop,nop,TS val 1582058935 ecr 563956123], length 204
00:20:53.901262 IP 178.128.229.39.ssh > 198.96.87.75.52485: Flags [P.], seq 50220:50424, ack 37, win 501, options [nop,nop,TS val 1582058935 ecr 563956123], length 204
00:20:53.901406 IP 178.128.229.39.ssh > 198.96.87.75.52485: Flags [P.], seq 50424:50628, ack 37, win 501, options [nop,nop,TS val 1582058935 ecr 563956123], length 204
00:20:53.901558 IP 178.128.229.39.ssh > 198.96.87.75.52485: Flags [P.], seq 50628:50832, ack 37, win 501, options [nop,nop,TS val 1582058935 ecr 563956123], length 204
00:20:53.901696 IP 178.128.229.39.ssh > 198.96.87.75.52485: Flags [P.], seq 50832:51036, ack 37, win 501, options [nop,nop,TS val 1582058936 ecr 563956123], length 204
00:20:53.901828 IP 178.128.229.39.ssh > 198.96.87.75.52485: Flags [P.], seq 51036:51240, ack 37, win 501, options [nop,nop,TS val 1582058936 ecr 563956123], length 204
00:20:53.901962 IP 178.128.229.39.ssh > 198.96.87.75.52485: Flags [P.], seq 51240:51444, ack 37, win 501, options [nop,nop,TS val 1582058936 ecr 563956123], length 204
00:20:53.902094 IP 178.128.229.39.ssh > 198.96.87.75.52485: Flags [P.], seq 51444:51648, ack 37, win 501, options [nop,nop,TS val 1582058936 ecr 563956123], length 204
00:20:53.902224 IP 178.128.229.39.ssh > 198.96.87.75.52485: Flags [P.], seq 51648:51852, ack 37, win 501, options [nop,nop,TS val 1582058936 ecr 563956123], length 204
00:20:53.902353 IP 178.128.229.39.ssh > 198.96.87.75.52485: Flags [P.], seq 51852:52056, ack 37, win 501, options [nop,nop,TS val 1582058936 ecr 563956123], length 204
00:20:53.902480 IP 178.128.229.39.ssh > 198.96.87.75.52485: Flags [P.], seq 52056:52260, ack 37, win 501, options [nop,nop,TS val 1582058936 ecr 563956123], length 204
00:20:53.902611 IP 178.128.229.39.ssh > 198.96.87.75.52485: Flags [P.], seq 52260:52464, ack 37, win 501, options [nop,nop,TS val 1582058937 ecr 563956123], length 204
00:20:53.902741 IP 178.128.229.39.ssh > 198.96.87.75.52485: Flags [P.], seq 52464:52668, ack 37, win 501, options [nop,nop,TS val 1582058937 ecr 563956123], length 204
00:20:53.902871 IP 178.128.229.39.ssh > 198.96.87.75.52485: Flags [P.], seq 52668:52872, ack 37, win 501, options [nop,nop,TS val 1582058937 ecr 563956123], length 204
00:20:53.903004 IP 178.128.229.39.ssh > 198.96.87.75.52485: Flags [P.], seq 52872:53076, ack 37, win 501, options [nop,nop,TS val 1582058937 ecr 563956123], length 204
00:20:53.903137 IP 178.128.229.39.ssh > 198.96.87.75.52485: Flags [P.], seq 53076:53280, ack 37, win 501, options [nop,nop,TS val 1582058937 ecr 563956123], length 204
00:20:53.903267 IP 198.96.87.75.52485 > 178.128.229.39.ssh: Flags [.], ack 38432, win 1983, options [nop,nop,TS val 563956127 ecr 1582058927], length 0
00:20:53.903267 IP 198.96.87.75.52485 > 178.128.229.39.ssh: Flags [.], ack 39284, win 1970, options [nop,nop,TS val 563956127 ecr 1582058927], length 0
00:20:53.903267 IP 198.96.87.75.52485 > 178.128.229.39.ssh: Flags [.], ack 39664, win 1964, options [nop,nop,TS val 563956127 ecr 1582058928], length 0
00:20:53.903268 IP 198.96.87.75.52485 > 178.128.229.39.ssh: Flags [.], ack 39868, win 1961, options [nop,nop,TS val 563956127 ecr 1582058928], length 0
00:20:53.903268 IP 198.96.87.75.52485 > 178.128.229.39.ssh: Flags [.], ack 40072, win 1957, options [nop,nop,TS val 563956127 ecr 1582058928], length 0
00:20:53.903268 IP 198.96.87.75.52485 > 178.128.229.39.ssh: Flags [.], ack 40276, win 1954, options [nop,nop,TS val 563956127 ecr 1582058928], length 0
00:20:53.903268 IP 198.96.87.75.52485 > 178.128.229.39.ssh: Flags [.], ack 40480, win 1951, options [nop,nop,TS val 563956127 ecr 1582058928], length 0
00:20:53.903268 IP 198.96.87.75.52485 > 178.128.229.39.ssh: Flags [.], ack 40684, win 1948, options [nop,nop,TS val 563956127 ecr 1582058929], length 0
00:20:53.903327 IP 198.96.87.75.52485 > 178.128.229.39.ssh: Flags [.], ack 40888, win 1945, options [nop,nop,TS val 563956127 ecr 1582058929], length 0
00:20:53.903328 IP 198.96.87.75.52485 > 178.128.229.39.ssh: Flags [.], ack 41092, win 1941, options [nop,nop,TS val 563956127 ecr 1582058929], length 0
00:20:53.903328 IP 198.96.87.75.52485 > 178.128.229.39.ssh: Flags [.], ack 41296, win 1938, options [nop,nop,TS val 563956127 ecr 1582058929], length 0
00:20:53.903328 IP 198.96.87.75.52485 > 178.128.229.39.ssh: Flags [.], ack 41500, win 1935, options [nop,nop,TS val 563956127 ecr 1582058929], length 0
00:20:53.903328 IP 198.96.87.75.52485 > 178.128.229.39.ssh: Flags [.], ack 41500, win 2048, options [nop,nop,TS val 563956127 ecr 1582058929], length 0
00:20:53.903328 IP 198.96.87.75.52485 > 178.128.229.39.ssh: Flags [.], ack 41704, win 2044, options [nop,nop,TS val 563956127 ecr 1582058929], length 0
00:20:53.903328 IP 198.96.87.75.52485 > 178.128.229.39.ssh: Flags [.], ack 41908, win 2041, options [nop,nop,TS val 563956127 ecr 1582058929], length 0
00:20:53.903383 IP 198.96.87.75.52485 > 178.128.229.39.ssh: Flags [.], ack 42112, win 2038, options [nop,nop,TS val 563956127 ecr 1582058929], length 0
00:20:53.903383 IP 198.96.87.75.52485 > 178.128.229.39.ssh: Flags [.], ack 42316, win 2035, options [nop,nop,TS val 563956127 ecr 1582058930], length 0
00:20:53.903384 IP 198.96.87.75.52485 > 178.128.229.39.ssh: Flags [.], ack 42520, win 2032, options [nop,nop,TS val 563956127 ecr 1582058930], length 0
00:20:53.903384 IP 198.96.87.75.52485 > 178.128.229.39.ssh: Flags [.], ack 42724, win 2028, options [nop,nop,TS val 563956127 ecr 1582058930], length 0
00:20:53.903384 IP 198.96.87.75.52485 > 178.128.229.39.ssh: Flags [.], ack 42928, win 2025, options [nop,nop,TS val 563956127 ecr 1582058930], length 0
00:20:53.903384 IP 198.96.87.75.52485 > 178.128.229.39.ssh: Flags [.], ack 43132, win 2022, options [nop,nop,TS val 563956127 ecr 1582058930], length 0
00:20:53.903384 IP 198.96.87.75.52485 > 178.128.229.39.ssh: Flags [.], ack 43488, win 2016, options [nop,nop,TS val 563956127 ecr 1582058930], length 0
00:20:53.903384 IP 198.96.87.75.52485 > 178.128.229.39.ssh: Flags [.], ack 43692, win 2013, options [nop,nop,TS val 563956127 ecr 1582058930], length 0
00:20:53.903420 IP 198.96.87.75.52485 > 178.128.229.39.ssh: Flags [.], ack 43896, win 2010, options [nop,nop,TS val 563956127 ecr 1582058931], length 0
00:20:53.903420 IP 198.96.87.75.52485 > 178.128.229.39.ssh: Flags [.], ack 44100, win 2007, options [nop,nop,TS val 563956127 ecr 1582058931], length 0
00:20:53.903420 IP 198.96.87.75.52485 > 178.128.229.39.ssh: Flags [.], ack 44304, win 2004, options [nop,nop,TS val 563956127 ecr 1582058931], length 0
00:20:53.903420 IP 198.96.87.75.52485 > 178.128.229.39.ssh: Flags [.], ack 44508, win 2001, options [nop,nop,TS val 563956127 ecr 1582058931], length 0
00:20:53.903420 IP 198.96.87.75.52485 > 178.128.229.39.ssh: Flags [.], ack 44712, win 1997, options [nop,nop,TS val 563956127 ecr 1582058931], length 0
00:20:53.903476 IP 198.96.87.75.52485 > 178.128.229.39.ssh: Flags [.], ack 44916, win 1994, options [nop,nop,TS val 563956127 ecr 1582058931], length 0
00:20:53.903476 IP 198.96.87.75.52485 > 178.128.229.39.ssh: Flags [.], ack 45120, win 1991, options [nop,nop,TS val 563956127 ecr 1582058931], length 0
