root@lamp-ubuntu-s-1vcpu-1gb-tor1-01:~# tcpdump -i eth0
tcpdump: verbose output suppressed, use -v or -vv for full protocol decode
listening on eth0, link-type EN10MB (Ethernet), capture size 262144 bytes
00:15:08.174577 IP 178.128.229.39.ssh > 198.96.87.75.52485: Flags [P.], seq 3561497373:3561497481, ack 1929791290, win 501, options [nop,nop,TS val 1581713208 ecr 563613432], length 108
00:15:08.174734 IP 178.128.229.39.ssh > 198.96.87.75.52485: Flags [P.], seq 108:144, ack 1, win 501, options [nop,nop,TS val 1581713209 ecr 563613432], length 36
00:15:08.174890 IP 178.128.229.39.ssh > 198.96.87.75.52485: Flags [P.], seq 144:252, ack 1, win 501, options [nop,nop,TS val 1581713209 ecr 563613432], length 108
00:15:08.175005 IP 178.128.229.39.ssh > 198.96.87.75.52485: Flags [P.], seq 252:288, ack 1, win 501, options [nop,nop,TS val 1581713209 ecr 563613432], length 36
00:15:08.176074 IP 178.128.229.39.38153 > dns.google.domain: 26200+ PTR? 75.87.96.198.in-addr.arpa. (43)
00:15:08.177460 IP 198.96.87.75.52485 > 178.128.229.39.ssh: Flags [.], ack 108, win 2046, options [nop,nop,TS val 563613441 ecr 1581713208], length 0
00:15:08.178864 IP 198.96.87.75.52485 > 178.128.229.39.ssh: Flags [.], ack 144, win 2047, options [nop,nop,TS val 563613442 ecr 1581713209], length 0
00:15:08.178865 IP 198.96.87.75.52485 > 178.128.229.39.ssh: Flags [.], ack 252, win 2045, options [nop,nop,TS val 563613442 ecr 1581713209], length 0
00:15:08.178865 IP 198.96.87.75.52485 > 178.128.229.39.ssh: Flags [.], ack 288, win 2045, options [nop,nop,TS val 563613442 ecr 1581713209], length 0
00:15:08.181486 IP dns.google.domain > 178.128.229.39.38153: 26200 NXDomain 0/1/0 (108)
00:15:08.181904 IP 178.128.229.39.39448 > dns.google.domain: 20070+ PTR? 39.229.128.178.in-addr.arpa. (45)
00:15:08.184370 IP dns.google.domain > 178.128.229.39.39448: 20070 NXDomain 0/1/0 (112)
00:15:08.184729 IP 178.128.229.39.ssh > 198.96.87.75.52485: Flags [P.], seq 288:508, ack 1, win 501, options [nop,nop,TS val 1581713219 ecr 563613442], length 220
00:15:08.184966 IP 178.128.229.39.ssh > 198.96.87.75.52485: Flags [P.], seq 508:544, ack 1, win 501, options [nop,nop,TS val 1581713219 ecr 563613442], length 36
00:15:08.185185 IP 178.128.229.39.ssh > 198.96.87.75.52485: Flags [P.], seq 544:740, ack 1, win 501, options [nop,nop,TS val 1581713219 ecr 563613442], length 196
00:15:08.185350 IP 178.128.229.39.ssh > 198.96.87.75.52485: Flags [P.], seq 740:776, ack 1, win 501, options [nop,nop,TS val 1581713219 ecr 563613442], length 36
00:15:08.185523 IP 178.128.229.39.ssh > 198.96.87.75.52485: Flags [P.], seq 776:972, ack 1, win 501, options [nop,nop,TS val 1581713219 ecr 563613442], length 196
00:15:08.185656 IP 178.128.229.39.ssh > 198.96.87.75.52485: Flags [P.], seq 972:1008, ack 1, win 501, options [nop,nop,TS val 1581713220 ecr 563613442], length 36
00:15:08.185847 IP 178.128.229.39.ssh > 198.96.87.75.52485: Flags [P.], seq 1008:1204, ack 1, win 501, options [nop,nop,TS val 1581713220 ecr 563613442], length 196
00:15:08.185996 IP 178.128.229.39.ssh > 198.96.87.75.52485: Flags [P.], seq 1204:1240, ack 1, win 501, options [nop,nop,TS val 1581713220 ecr 563613442], length 36
00:15:08.186320 IP 178.128.229.39.53296 > dns.google.domain: 58268+ PTR? 8.8.8.8.in-addr.arpa. (38)
00:15:08.187436 IP dns.google.domain > 178.128.229.39.53296: 58268 1/0/0 PTR dns.google. (62)
00:15:08.187742 IP 178.128.229.39.ssh > 198.96.87.75.52485: Flags [P.], seq 1240:1380, ack 1, win 501, options [nop,nop,TS val 1581713222 ecr 563613442], length 140
00:15:08.187929 IP 178.128.229.39.ssh > 198.96.87.75.52485: Flags [P.], seq 1380:1416, ack 1, win 501, options [nop,nop,TS val 1581713222 ecr 563613442], length 36
00:15:08.189178 IP 198.96.87.75.52485 > 178.128.229.39.ssh: Flags [.], ack 508, win 2044, options [nop,nop,TS val 563613451 ecr 1581713219], length 0
00:15:08.189179 IP 198.96.87.75.52485 > 178.128.229.39.ssh: Flags [.], ack 544, win 2044, options [nop,nop,TS val 563613451 ecr 1581713219], length 0
00:15:08.189232 IP 178.128.229.39.ssh > 198.96.87.75.52485: Flags [P.], seq 1416:2612, ack 1, win 501, options [nop,nop,TS val 1581713223 ecr 563613451], length 1196
00:15:08.189344 IP 178.128.229.39.ssh > 198.96.87.75.52485: Flags [P.], seq 2612:2648, ack 1, win 501, options [nop,nop,TS val 1581713223 ecr 563613451], length 36
00:15:08.189532 IP 178.128.229.39.ssh > 198.96.87.75.52485: Flags [P.], seq 2648:2772, ack 1, win 501, options [nop,nop,TS val 1581713223 ecr 563613451], length 124
00:15:08.189688 IP 178.128.229.39.ssh > 198.96.87.75.52485: Flags [P.], seq 2772:2808, ack 1, win 501, options [nop,nop,TS val 1581713224 ecr 563613451], length 36
00:15:08.190929 IP 198.96.87.75.52485 > 178.128.229.39.ssh: Flags [.], ack 740, win 2044, options [nop,nop,TS val 563613453 ecr 1581713219], length 0
00:15:08.190929 IP 198.96.87.75.52485 > 178.128.229.39.ssh: Flags [.], ack 776, win 2044, options [nop,nop,TS val 563613453 ecr 1581713219], length 0
00:15:08.190930 IP 198.96.87.75.52485 > 178.128.229.39.ssh: Flags [.], ack 972, win 2041, options [nop,nop,TS val 563613453 ecr 1581713219], length 0
00:15:08.190930 IP 198.96.87.75.52485 > 178.128.229.39.ssh: Flags [.], ack 1008, win 2040, options [nop,nop,TS val 563613453 ecr 1581713220], length 0
00:15:08.190930 IP 198.96.87.75.52485 > 178.128.229.39.ssh: Flags [.], ack 1204, win 2037, options [nop,nop,TS val 563613453 ecr 1581713220], length 0
00:15:08.190930 IP 198.96.87.75.52485 > 178.128.229.39.ssh: Flags [.], ack 1240, win 2037, options [nop,nop,TS val 563613453 ecr 1581713220], length 0
00:15:08.190979 IP 178.128.229.39.ssh > 198.96.87.75.52485: Flags [P.], seq 2808:3968, ack 1, win 501, options [nop,nop,TS val 1581713225 ecr 563613453], length 1160
00:15:08.191170 IP 178.128.229.39.ssh > 198.96.87.75.52485: Flags [P.], seq 3968:4164, ack 1, win 501, options [nop,nop,TS val 1581713225 ecr 563613453], length 196
00:15:08.191318 IP 178.128.229.39.ssh > 198.96.87.75.52485: Flags [P.], seq 4164:4200, ack 1, win 501, options [nop,nop,TS val 1581713225 ecr 563613453], length 36
00:15:08.191502 IP 178.128.229.39.ssh > 198.96.87.75.52485: Flags [P.], seq 4200:4404, ack 1, win 501, options [nop,nop,TS val 1581713225 ecr 563613453], length 204
00:15:08.191716 IP 178.128.229.39.ssh > 198.96.87.75.52485: Flags [P.], seq 4404:4440, ack 1, win 501, options [nop,nop,TS val 1581713226 ecr 563613453], length 36
00:15:08.191863 IP 198.96.87.75.52485 > 178.128.229.39.ssh: Flags [.], ack 1380, win 2045, options [nop,nop,TS val 563613453 ecr 1581713222], length 0
00:15:08.191863 IP 198.96.87.75.52485 > 178.128.229.39.ssh: Flags [.], ack 1416, win 2045, options [nop,nop,TS val 563613453 ecr 1581713222], length 0
00:15:08.191953 IP 178.128.229.39.ssh > 198.96.87.75.52485: Flags [P.], seq 4440:4644, ack 1, win 501, options [nop,nop,TS val 1581713226 ecr 563613453], length 204
00:15:08.192086 IP 178.128.229.39.ssh > 198.96.87.75.52485: Flags [P.], seq 4644:4680, ack 1, win 501, options [nop,nop,TS val 1581713226 ecr 563613453], length 36
00:15:08.192251 IP 178.128.229.39.ssh > 198.96.87.75.52485: Flags [P.], seq 4680:4820, ack 1, win 501, options [nop,nop,TS val 1581713226 ecr 563613453], length 140
00:15:08.192375 IP 178.128.229.39.ssh > 198.96.87.75.52485: Flags [P.], seq 4820:4856, ack 1, win 501, options [nop,nop,TS val 1581713226 ecr 563613453], length 36
00:15:08.192569 IP 178.128.229.39.ssh > 198.96.87.75.52485: Flags [P.], seq 4856:4988, ack 1, win 501, options [nop,nop,TS val 1581713226 ecr 563613453], length 132
00:15:08.192647 IP 198.96.87.75.52485 > 178.128.229.39.ssh: Flags [.], ack 2612, win 2029, options [nop,nop,TS val 563613454 ecr 1581713223], length 0
00:15:08.192647 IP 198.96.87.75.52485 > 178.128.229.39.ssh: Flags [.], ack 2648, win 2028, options [nop,nop,TS val 563613454 ecr 1581713223], length 0
00:15:08.192767 IP 178.128.229.39.ssh > 198.96.87.75.52485: Flags [P.], seq 4988:5024, ack 1, win 501, options [nop,nop,TS val 1581713227 ecr 563613454], length 36
00:15:08.193003 IP 178.128.229.39.ssh > 198.96.87.75.52485: Flags [P.], seq 5024:5228, ack 1, win 501, options [nop,nop,TS val 1581713227 ecr 563613454], length 204
00:15:08.193162 IP 178.128.229.39.ssh > 198.96.87.75.52485: Flags [P.], seq 5228:5264, ack 1, win 501, options [nop,nop,TS val 1581713227 ecr 563613454], length 36
00:15:08.193348 IP 178.128.229.39.ssh > 198.96.87.75.52485: Flags [P.], seq 5264:5468, ack 1, win 501, options [nop,nop,TS val 1581713227 ecr 563613454], length 204
00:15:08.193530 IP 178.128.229.39.ssh > 198.96.87.75.52485: Flags [P.], seq 5468:5504, ack 1, win 501, options [nop,nop,TS val 1581713227 ecr 563613454], length 36
00:15:08.193716 IP 178.128.229.39.ssh > 198.96.87.75.52485: Flags [P.], seq 5504:5692, ack 1, win 501, options [nop,nop,TS val 1581713228 ecr 563613454], length 188
00:15:08.194039 IP 178.128.229.39.ssh > 198.96.87.75.52485: Flags [P.], seq 5728:5916, ack 1, win 501, options [nop,nop,TS val 1581713228 ecr 563613454], length 188
00:15:08.194543 IP 178.128.229.39.ssh > 198.96.87.75.52485: Flags [P.], seq 5952:6484, ack 1, win 501, options [nop,nop,TS val 1581713228 ecr 563613455], length 532
00:15:08.194881 IP 178.128.229.39.ssh > 198.96.87.75.52485: Flags [P.], seq 6484:7288, ack 1, win 501, options [nop,nop,TS val 1581713229 ecr 563613455], length 804
00:15:08.195211 IP 178.128.229.39.ssh > 198.96.87.75.52485: Flags [P.], seq 7288:7796, ack 1, win 501, options [nop,nop,TS val 1581713229 ecr 563613455], length 508
00:15:08.195673 IP 178.128.229.39.ssh > 198.96.87.75.52485: Flags [P.], seq 7796:8648, ack 1, win 501, options [nop,nop,TS val 1581713230 ecr 563613455], length 852
00:15:08.195961 IP 178.128.229.39.ssh > 198.96.87.75.52485: Flags [P.], seq 8648:9172, ack 1, win 501, options [nop,nop,TS val 1581713230 ecr 563613455], length 524
00:15:08.196856 IP 198.96.87.75.52485 > 178.128.229.39.ssh: Flags [.], ack 3968, win 2029, options [nop,nop,TS val 563613457 ecr 1581713225], length 0
00:15:08.196856 IP 198.96.87.75.52485 > 178.128.229.39.ssh: Flags [.], ack 4164, win 2026, options [nop,nop,TS val 563613457 ecr 1581713225], length 0
00:15:08.196856 IP 198.96.87.75.52485 > 178.128.229.39.ssh: Flags [.], ack 4200, win 2026, options [nop,nop,TS val 563613457 ecr 1581713225], length 0
00:15:08.196856 IP 198.96.87.75.52485 > 178.128.229.39.ssh: Flags [.], ack 4404, win 2023, options [nop,nop,TS val 563613457 ecr 1581713225], length 0
00:15:08.196856 IP 198.96.87.75.52485 > 178.128.229.39.ssh: Flags [.], ack 4440, win 2022, options [nop,nop,TS val 563613457 ecr 1581713226], length 0
00:15:08.196857 IP 198.96.87.75.52485 > 178.128.229.39.ssh: Flags [.], ack 4644, win 2019, options [nop,nop,TS val 563613457 ecr 1581713226], length 0
00:15:08.196857 IP 198.96.87.75.52485 > 178.128.229.39.ssh: Flags [.], ack 4680, win 2018, options [nop,nop,TS val 563613457 ecr 1581713226], length 0
00:15:08.196857 IP 198.96.87.75.52485 > 178.128.229.39.ssh: Flags [.], ack 4820, win 2016, options [nop,nop,TS val 563613457 ecr 1581713226], length 0
00:15:08.196924 IP 178.128.229.39.ssh > 198.96.87.75.52485: Flags [P.], seq 9172:11116, ack 1, win 501, options [nop,nop,TS val 1581713231 ecr 563613457], length 1944
00:15:08.196975 IP 198.96.87.75.52485 > 178.128.229.39.ssh: Flags [.], ack 4856, win 2016, options [nop,nop,TS val 563613457 ecr 1581713226], length 0
00:15:08.196975 IP 198.96.87.75.52485 > 178.128.229.39.ssh: Flags [.], ack 4988, win 2013, options [nop,nop,TS val 563613457 ecr 1581713226], length 0
00:15:08.196975 IP 198.96.87.75.52485 > 178.128.229.39.ssh: Flags [.], ack 5024, win 2042, options [nop,nop,TS val 563613457 ecr 1581713227], length 0
00:15:08.196975 IP 198.96.87.75.52485 > 178.128.229.39.ssh: Flags [.], ack 5228, win 2044, options [nop,nop,TS val 563613457 ecr 1581713227], length 0
00:15:08.197156 IP 178.128.229.39.ssh > 198.96.87.75.52485: Flags [P.], seq 11116:11320, ack 1, win 501, options [nop,nop,TS val 1581713231 ecr 563613457], length 204
00:15:08.197317 IP 178.128.229.39.ssh > 198.96.87.75.52485: Flags [P.], seq 11320:11356, ack 1, win 501, options [nop,nop,TS val 1581713231 ecr 563613457], length 36
00:15:08.197514 IP 178.128.229.39.ssh > 198.96.87.75.52485: Flags [P.], seq 11356:11560, ack 1, win 501, options [nop,nop,TS val 1581713231 ecr 563613457], length 204
00:15:08.197726 IP 178.128.229.39.ssh > 198.96.87.75.52485: Flags [P.], seq 11560:11764, ack 1, win 501, options [nop,nop,TS val 1581713232 ecr 563613457], length 204
00:15:08.198017 IP 178.128.229.39.ssh > 198.96.87.75.52485: Flags [P.], seq 11764:12296, ack 1, win 501, options [nop,nop,TS val 1581713232 ecr 563613457], length 532
00:15:08.198390 IP 178.128.229.39.ssh > 198.96.87.75.52485: Flags [P.], seq 12296:13244, ack 1, win 501, options [nop,nop,TS val 1581713232 ecr 563613457], length 948
00:15:08.198705 IP 198.96.87.75.52485 > 178.128.229.39.ssh: Flags [.], ack 5264, win 2047, options [nop,nop,TS val 563613459 ecr 1581713227], length 0
00:15:08.198705 IP 198.96.87.75.52485 > 178.128.229.39.ssh: Flags [.], ack 5468, win 2044, options [nop,nop,TS val 563613459 ecr 1581713227], length 0
00:15:08.198706 IP 198.96.87.75.52485 > 178.128.229.39.ssh: Flags [.], ack 5504, win 2043, options [nop,nop,TS val 563613459 ecr 1581713227], length 0
00:15:08.198706 IP 198.96.87.75.52485 > 178.128.229.39.ssh: Flags [.], ack 5692, win 2040, options [nop,nop,TS val 563613459 ecr 1581713228], length 0
00:15:08.198706 IP 198.96.87.75.52485 > 178.128.229.39.ssh: Flags [.], ack 5728, win 2040, options [nop,nop,TS val 563613459 ecr 1581713228], length 0
00:15:08.198706 IP 198.96.87.75.52485 > 178.128.229.39.ssh: Flags [.], ack 5916, win 2037, options [nop,nop,TS val 563613459 ecr 1581713228], length 0
00:15:08.198706 IP 198.96.87.75.52485 > 178.128.229.39.ssh: Flags [.], ack 5952, win 2036, options [nop,nop,TS val 563613459 ecr 1581713228], length 0
00:15:08.198706 IP 198.96.87.75.52485 > 178.128.229.39.ssh: Flags [.], ack 6484, win 2028, options [nop,nop,TS val 563613459 ecr 1581713228], length 0
00:15:08.198787 IP 198.96.87.75.52485 > 178.128.229.39.ssh: Flags [.], ack 7288, win 2015, options [nop,nop,TS val 563613459 ecr 1581713229], length 0
00:15:08.198787 IP 198.96.87.75.52485 > 178.128.229.39.ssh: Flags [.], ack 7796, win 2007, options [nop,nop,TS val 563613459 ecr 1581713229], length 0
00:15:08.198803 IP 178.128.229.39.ssh > 198.96.87.75.52485: Flags [P.], seq 13244:13752, ack 1, win 501, options [nop,nop,TS val 1581713233 ecr 563613457], length 508
00:15:08.199362 IP 198.96.87.75.52485 > 178.128.229.39.ssh: Flags [.], ack 8648, win 2034, options [nop,nop,TS val 563613460 ecr 1581713230], length 0
00:15:08.199363 IP 198.96.87.75.52485 > 178.128.229.39.ssh: Flags [.], ack 9172, win 2026, options [nop,nop,TS val 563613460 ecr 1581713230], length 0
00:15:08.199471 IP 178.128.229.39.ssh > 198.96.87.75.52485: Flags [P.], seq 13752:15708, ack 1, win 501, options [nop,nop,TS val 1581713233 ecr 563613460], length 1956
00:15:08.200078 IP 178.128.229.39.ssh > 198.96.87.75.52485: Flags [P.], seq 15708:17432, ack 1, win 501, options [nop,nop,TS val 1581713234 ecr 563613460], length 1724
00:15:08.200380 IP 178.128.229.39.ssh > 198.96.87.75.52485: Flags [P.], seq 17432:17812, ack 1, win 501, options [nop,nop,TS val 1581713234 ecr 563613460], length 380
00:15:08.200605 IP 178.128.229.39.ssh > 198.96.87.75.52485: Flags [P.], seq 17812:18016, ack 1, win 501, options [nop,nop,TS val 1581713235 ecr 563613460], length 204
00:15:08.200860 IP 178.128.229.39.ssh > 198.96.87.75.52485: Flags [P.], seq 18016:18220, ack 1, win 501, options [nop,nop,TS val 1581713235 ecr 563613460], length 204
00:15:08.201087 IP 178.128.229.39.ssh > 198.96.87.75.52485: Flags [P.], seq 18220:18424, ack 1, win 501, options [nop,nop,TS val 1581713235 ecr 563613460], length 204
00:15:08.201314 IP 178.128.229.39.ssh > 198.96.87.75.52485: Flags [P.], seq 18424:18628, ack 1, win 501, options [nop,nop,TS val 1581713235 ecr 563613460], length 204
00:15:08.201533 IP 178.128.229.39.ssh > 198.96.87.75.52485: Flags [P.], seq 18628:18832, ack 1, win 501, options [nop,nop,TS val 1581713235 ecr 563613460], length 204
00:15:08.201754 IP 178.128.229.39.ssh > 198.96.87.75.52485: Flags [P.], seq 18832:19036, ack 1, win 501, options [nop,nop,TS val 1581713236 ecr 563613460], length 204
00:15:08.201988 IP 178.128.229.39.ssh > 198.96.87.75.52485: Flags [P.], seq 19036:19240, ack 1, win 501, options [nop,nop,TS val 1581713236 ecr 563613460], length 204
00:15:08.202200 IP 178.128.229.39.ssh > 198.96.87.75.52485: Flags [P.], seq 19240:19444, ack 1, win 501, options [nop,nop,TS val 1581713236 ecr 563613460], length 204
00:15:08.202395 IP 198.96.87.75.52485 > 178.128.229.39.ssh: Flags [.], ack 11116, win 2017, options [nop,nop,TS val 563613462 ecr 1581713231], length 0
00:15:08.202395 IP 198.96.87.75.52485 > 178.128.229.39.ssh: Flags [.], ack 11320, win 2014, options [nop,nop,TS val 563613462 ecr 1581713231], length 0
00:15:08.202396 IP 198.96.87.75.52485 > 178.128.229.39.ssh: Flags [.], ack 11356, win 2013, options [nop,nop,TS val 563613462 ecr 1581713231], length 0
00:15:08.202396 IP 198.96.87.75.52485 > 178.128.229.39.ssh: Flags [.], ack 11560, win 2010, options [nop,nop,TS val 563613462 ecr 1581713231], length 0
00:15:08.202396 IP 198.96.87.75.52485 > 178.128.229.39.ssh: Flags [.], ack 11764, win 2044, options [nop,nop,TS val 563613462 ecr 1581713232], length 0
00:15:08.202396 IP 198.96.87.75.52485 > 178.128.229.39.ssh: Flags [.], ack 12296, win 2036, options [nop,nop,TS val 563613462 ecr 1581713232], length 0
00:15:08.202396 IP 198.96.87.75.52485 > 178.128.229.39.ssh: Flags [.], ack 13244, win 2021, options [nop,nop,TS val 563613462 ecr 1581713232], length 0
00:15:08.202525 IP 178.128.229.39.ssh > 198.96.87.75.52485: Flags [P.], seq 19444:19648, ack 1, win 501, options [nop,nop,TS val 1581713236 ecr 563613462], length 204
00:15:08.202987 IP 178.128.229.39.ssh > 198.96.87.75.52485: Flags [P.], seq 19648:20924, ack 1, win 501, options [nop,nop,TS val 1581713237 ecr 563613462], length 1276
00:15:08.203109 IP 198.96.87.75.52485 > 178.128.229.39.ssh: Flags [.], ack 13752, win 2040, options [nop,nop,TS val 563613462 ecr 1581713233], length 0
00:15:08.203109 IP 198.96.87.75.52485 > 178.128.229.39.ssh: Flags [.], ack 15708, win 2009, options [nop,nop,TS val 563613462 ecr 1581713233], length 0
00:15:08.203109 IP 198.96.87.75.52485 > 178.128.229.39.ssh: Flags [P.], seq 1:37, ack 15708, win 2048, options [nop,nop,TS val 563613463 ecr 1581713233], length 36
00:15:08.203423 IP 178.128.229.39.ssh > 198.96.87.75.52485: Flags [P.], seq 20924:21600, ack 37, win 501, options [nop,nop,TS val 1581713237 ecr 563613463], length 676
00:15:08.203685 IP 178.128.229.39.ssh > 198.96.87.75.52485: Flags [P.], seq 21600:21804, ack 37, win 501, options [nop,nop,TS val 1581713238 ecr 563613463], length 204
00:15:08.203888 IP 178.128.229.39.ssh > 198.96.87.75.52485: Flags [P.], seq 21804:22008, ack 37, win 501, options [nop,nop,TS val 1581713238 ecr 563613463], length 204
00:15:08.204086 IP 178.128.229.39.ssh > 198.96.87.75.52485: Flags [P.], seq 22008:22212, ack 37, win 501, options [nop,nop,TS val 1581713238 ecr 563613463], length 204
00:15:08.204283 IP 178.128.229.39.ssh > 198.96.87.75.52485: Flags [P.], seq 22212:22416, ack 37, win 501, options [nop,nop,TS val 1581713238 ecr 563613463], length 204
00:15:08.204498 IP 178.128.229.39.ssh > 198.96.87.75.52485: Flags [P.], seq 22416:22620, ack 37, win 501, options [nop,nop,TS val 1581713238 ecr 563613463], length 204
00:15:08.204705 IP 178.128.229.39.ssh > 198.96.87.75.52485: Flags [P.], seq 22620:22824, ack 37, win 501, options [nop,nop,TS val 1581713239 ecr 563613463], length 204
00:15:08.204944 IP 178.128.229.39.ssh > 198.96.87.75.52485: Flags [P.], seq 22824:23028, ack 37, win 501, options [nop,nop,TS val 1581713239 ecr 563613463], length 204
00:15:08.205161 IP 178.128.229.39.ssh > 198.96.87.75.52485: Flags [P.], seq 23028:23232, ack 37, win 501, options [nop,nop,TS val 1581713239 ecr 563613463], length 204
00:15:08.205367 IP 178.128.229.39.ssh > 198.96.87.75.52485: Flags [P.], seq 23232:23436, ack 37, win 501, options [nop,nop,TS val 1581713239 ecr 563613463], length 204
00:15:08.205576 IP 178.128.229.39.ssh > 198.96.87.75.52485: Flags [P.], seq 23436:23640, ack 37, win 501, options [nop,nop,TS val 1581713239 ecr 563613463], length 204
00:15:08.205774 IP 198.96.87.75.52485 > 178.128.229.39.ssh: Flags [.], ack 17432, win 2021, options [nop,nop,TS val 563613465 ecr 1581713234], length 0
00:15:08.205774 IP 198.96.87.75.52485 > 178.128.229.39.ssh: Flags [.], ack 17812, win 2015, options [nop,nop,TS val 563613465 ecr 1581713234], length 0
00:15:08.205775 IP 198.96.87.75.52485 > 178.128.229.39.ssh: Flags [.], ack 18016, win 2011, options [nop,nop,TS val 563613465 ecr 1581713235], length 0
00:15:08.205775 IP 198.96.87.75.52485 > 178.128.229.39.ssh: Flags [.], ack 18220, win 2008, options [nop,nop,TS val 563613465 ecr 1581713235], length 0
00:15:08.205775 IP 198.96.87.75.52485 > 178.128.229.39.ssh: Flags [.], ack 18424, win 2005, options [nop,nop,TS val 563613465 ecr 1581713235], length 0
00:15:08.205775 IP 198.96.87.75.52485 > 178.128.229.39.ssh: Flags [.], ack 18628, win 2002, options [nop,nop,TS val 563613465 ecr 1581713235], length 0
00:15:08.205776 IP 198.96.87.75.52485 > 178.128.229.39.ssh: Flags [.], ack 18832, win 1999, options [nop,nop,TS val 563613465 ecr 1581713235], length 0
00:15:08.205776 IP 198.96.87.75.52485 > 178.128.229.39.ssh: Flags [.], ack 19036, win 1996, options [nop,nop,TS val 563613465 ecr 1581713236], length 0
00:15:08.205856 IP 198.96.87.75.52485 > 178.128.229.39.ssh: Flags [.], ack 19036, win 2048, options [nop,nop,TS val 563613465 ecr 1581713236], length 0
00:15:08.205927 IP 178.128.229.39.ssh > 198.96.87.75.52485: Flags [P.], seq 23640:23844, ack 37, win 501, options [nop,nop,TS val 1581713240 ecr 563613465], length 204
00:15:08.206472 IP 178.128.229.39.ssh > 198.96.87.75.52485: Flags [P.], seq 23844:25424, ack 37, win 501, options [nop,nop,TS val 1581713240 ecr 563613465], length 1580
00:15:08.206535 IP 198.96.87.75.52485 > 178.128.229.39.ssh: Flags [.], ack 19240, win 2044, options [nop,nop,TS val 563613465 ecr 1581713236], length 0
00:15:08.206536 IP 198.96.87.75.52485 > 178.128.229.39.ssh: Flags [.], ack 19444, win 2041, options [nop,nop,TS val 563613465 ecr 1581713236], length 0
00:15:08.206536 IP 198.96.87.75.52485 > 178.128.229.39.ssh: Flags [.], ack 19648, win 2038, options [nop,nop,TS val 563613465 ecr 1581713236], length 0
00:15:08.206861 IP 178.128.229.39.ssh > 198.96.87.75.52485: Flags [P.], seq 25424:26092, ack 37, win 501, options [nop,nop,TS val 1581713241 ecr 563613465], length 668
